sec,name,line,banner,stmt_preview
12,topology_sub_Power,4814,"LATEX VERSION: From the topology definition, every open set is a subset of X; equivalently T ⊆ P(X).","Theorem topology_sub_Power : forall X T:set, topology_on X T -> T c= Power X. let X T. assume HTx: topology_on X T. prove T c= Power X. claim H1: (((T c= Power X /\ Empty :e T) /\ X :e T) /\ (forall UFam :e Power T, Union UFam :e T)) /\ (fo"
12,open_in_topology,4844,"LATEX VERSION: If U is open in X (relative to T), then T is a topology on X.","Theorem open_in_topology : forall X T U:set, open_in X T U -> topology_on X T. let X T U. assume H: open_in X T U. exact (andEL (topology_on X T) (U :e T) H). Qed. "
12,open_in_elem,4853,"LATEX VERSION: If U is open in X, then U is an element of the topology T.","Theorem open_in_elem : forall X T U:set, open_in X T U -> U :e T. let X T U. assume H: open_in X T U. exact (andER (topology_on X T) (U :e T) H). Qed. "
12,open_inI,4862,"LATEX VERSION: If T is a topology on X and U∈T, then U is open in X.","Theorem open_inI : forall X T U:set, topology_on X T -> U :e T -> open_in X T U. let X T U. assume HT: topology_on X T. assume HU: U :e T. exact (andI (topology_on X T) (U :e T) HT HU). Qed. "
12,open_in_subset,4887,LATEX VERSION: Every open set U of X is a subset of X.,"Theorem open_in_subset : forall X T U:set, open_in X T U -> U c= X. let X T U. assume HU: open_in X T U. prove U c= X. claim HTx: topology_on X T. { exact (open_in_topology X T U HU). } claim HUT: U :e T. { exact (open_in_elem X T U HU). } "
12,topology_elem_subset,4903,"LATEX VERSION: If T is a topology on X and U∈T, then U⊆X.","Theorem topology_elem_subset : forall X T U:set, topology_on X T -> U :e T -> U c= X. let X T U. assume HTx: topology_on X T. assume HU: U :e T. prove U c= X. claim HUPower: U :e Power X. { exact ((topology_sub_Power X T HTx) U HU). } exact"
12,topology_has_empty,4916,"LATEX VERSION: By the topology axioms, ∅ is open (belongs to T).","Theorem topology_has_empty : forall X T:set, topology_on X T -> Empty :e T. let X T. assume HTx: topology_on X T. prove Empty :e T. claim H1: (((T c= Power X /\ Empty :e T) /\ X :e T) /\ (forall UFam :e Power T, Union UFam :e T)) /\ (forall"
12,topology_has_X,4935,"LATEX VERSION: By the topology axioms, X itself is open (belongs to T).","Theorem topology_has_X : forall X T:set, topology_on X T -> X :e T. let X T. assume HTx: topology_on X T. prove X :e T. claim H1: (((T c= Power X /\ Empty :e T) /\ X :e T) /\ (forall UFam :e Power T, Union UFam :e T)) /\ (forall U :e T, for"
12,topology_subset_axiom,4952,"LATEX VERSION: A topology on X is a collection of subsets of X, that is, T is contained in P(X).","Theorem topology_subset_axiom : forall X T:set, topology_on X T -> T c= Power X. let X T. assume HTx: topology_on X T. prove T c= Power X. claim H0: ((T c= Power X /\ Empty :e T) /\ X :e T) /\ (forall UFam :e Power T, Union UFam :e T). { ex"
12,topology_union_closed,4968,LATEX VERSION: The union of the elements of any subcollection of the topology is again an element of the topology.,"Theorem topology_union_closed : forall X T UFam:set, topology_on X T -> UFam c= T -> Union UFam :e T. let X T UFam. assume HTx: topology_on X T. assume HUFam: UFam c= T. prove Union UFam :e T. claim H1: (((T c= Power X /\ Empty :e T) /\ X :"
12,topology_union_closed_pow,4988,"LATEX VERSION: If UFam is a subcollection of T (UFam ∈ P(T)), then the union of UFam belongs to T.","Theorem topology_union_closed_pow : forall X T UFam:set, topology_on X T -> UFam :e Power T -> Union UFam :e T. let X T UFam. assume HTx: topology_on X T. assume HUFamPow: UFam :e Power T. prove Union UFam :e T. claim HUFamSub: UFam c= T. {"
12,topology_union_axiom,5001,LATEX VERSION: Property (2) of the topology axioms: arbitrary unions of open sets are open.,"Theorem topology_union_axiom : forall X T:set, topology_on X T -> forall UFam :e Power T, Union UFam :e T. let X T. assume HTx: topology_on X T. prove forall UFam :e Power T, Union UFam :e T. let UFam. assume HUFamPow: UFam :e Power T. exac"
12,topology_binintersect_closed,5013,LATEX VERSION: Property (3) of the topology axioms: the intersection of two open sets is open.,"Theorem topology_binintersect_closed : forall X T U V:set, topology_on X T -> U :e T -> V :e T -> U :/\: V :e T. let X T U V. assume HTx: topology_on X T. assume HU: U :e T. assume HV: V :e T. prove U :/\: V :e T. claim HIntersectAxiom: for"
12,topology_binintersect_axiom,5027,"LATEX VERSION: Property (3) of the topology axioms, stated as a rule for any U,V in T.","Theorem topology_binintersect_axiom : forall X T:set, topology_on X T -> forall U :e T, forall V :e T, U :/\: V :e T. let X T. assume HTx: topology_on X T. prove forall U :e T, forall V :e T, U :/\: V :e T. let U. assume HU: U :e T. let V. "
12,Empty_is_open,5040,LATEX VERSION: The empty set is an open set of X.,"Theorem Empty_is_open : forall X T:set, topology_on X T -> open_in X T Empty. let X T. assume HTx: topology_on X T. prove open_in X T Empty. prove topology_on X T /\ Empty :e T. apply andI. - exact HTx. - exact (topology_has_empty X T HTx)."
12,X_is_open,5053,LATEX VERSION: The whole set X is an open set of X.,"Theorem X_is_open : forall X T:set, topology_on X T -> open_in X T X. let X T. assume HTx: topology_on X T. prove open_in X T X. prove topology_on X T /\ X :e T. apply andI. - exact HTx. - exact (topology_has_X X T HTx). Qed. "
12,union_open,5066,LATEX VERSION: The union of any family of open sets is open.,"Theorem union_open : forall X T UFam:set, topology_on X T -> (forall U :e UFam, open_in X T U) -> open_in X T (Union UFam). let X T UFam. assume HTx: topology_on X T. assume HUFam: forall U :e UFam, open_in X T U. prove open_in X T (Union U"
12,binintersect_open,5089,LATEX VERSION: The intersection of two open sets is open.,"Theorem binintersect_open : forall X T U V:set, open_in X T U -> open_in X T V -> open_in X T (U :/\: V). let X T U V. assume HU: open_in X T U. assume HV: open_in X T V. prove open_in X T (U :/\: V). claim HTx: topology_on X T. { exact (an"
12,closed_in_topology,5118,"LATEX VERSION: If C is closed in X (relative to T), then T is a topology on X.","Theorem closed_in_topology : forall X T C:set, closed_in X T C -> topology_on X T. let X T C. assume H: closed_in X T C. exact (andEL (topology_on X T) (C c= X /\ exists U :e T, C = X :\: U) H). Qed. "
12,closed_in_package,5127,"LATEX VERSION: If C is closed, then C is the complement in X of some open set U.","Theorem closed_in_package : forall X T C:set, closed_in X T C -> C c= X /\ exists U :e T, C = X :\: U. let X T C. assume H: closed_in X T C. exact (andER (topology_on X T) (C c= X /\ exists U :e T, C = X :\: U) H). Qed. "
12,closed_inI,5136,LATEX VERSION: A set is closed if it is the complement of an open set.,"Theorem closed_inI : forall X T C:set, topology_on X T -> C c= X -> (exists U :e T, C = X :\: U) -> closed_in X T C. let X T C. assume HT: topology_on X T. assume HCsub: C c= X. assume Hex: exists U :e T, C = X :\: U. exact (andI (topology_"
12,closed_of_open_complement,5185,"LATEX VERSION: If U is open in topology T on X, then X\\U is closed in that topology.","Theorem closed_of_open_complement : forall X T U:set, topology_on X T -> U :e T -> closed_in X T (X :\: U). let X. let T. let U. assume Htop HU. prove closed_in X T (X :\: U). apply (closed_inI X T (X :\: U)). - exact Htop. - exact (setminu"
12,X_is_closed,5200,LATEX VERSION: The whole set X is closed in X.,"Theorem X_is_closed : forall X T:set, topology_on X T -> closed_in X T X. let X T. assume HTx: topology_on X T. prove closed_in X T X. apply (closed_inI X T X). - exact HTx. - exact (Subq_ref X). - witness Empty. apply andI. * exact (topolo"
12,Empty_is_closed,5227,LATEX VERSION: The empty set is closed in X.,"Theorem Empty_is_closed : forall X T:set, topology_on X T -> closed_in X T Empty. let X T. assume HTx: topology_on X T. prove closed_in X T Empty. apply (closed_inI X T Empty). - exact HTx. - exact (Subq_Empty X). - witness X. apply andI. *"
12,closed_binintersect,5253,LATEX VERSION: Complements turn finite intersections of closed sets into finite unions of open sets.,"Theorem closed_binintersect : forall X T C D:set, closed_in X T C -> closed_in X T D -> closed_in X T (C :/\: D). let X T C D. assume HC: closed_in X T C. assume HD: closed_in X T D. prove closed_in X T (C :/\: D). claim HTx: topology_on X "
12,closed_binunion,5380,LATEX VERSION: Complements turn finite unions of closed sets into finite intersections of open sets.,"Theorem closed_binunion : forall X T C D:set, closed_in X T C -> closed_in X T D -> closed_in X T (C :\/: D). let X T C D. assume HC: closed_in X T C. assume HD: closed_in X T D. prove closed_in X T (C :\/: D). claim HTx: topology_on X T. {"
12,open_of_closed_complement,5470,LATEX VERSION: The complement of a closed set is open.,"Theorem open_of_closed_complement : forall X T C:set, closed_in X T C -> open_in X T (X :\: C). let X T C. assume HC: closed_in X T C. prove open_in X T (X :\: C). claim HTx: topology_on X T. { exact (closed_in_topology X T C HC). } claim H"
12,topology_binunion_closed,5561,"LATEX VERSION: Since U ∪ V is the union of the pair {U,V}, any topology is closed under binary unions.","Theorem topology_binunion_closed : forall X T U V:set, topology_on X T -> U :e T -> V :e T -> U :\/: V :e T. let X T U V. assume HTx: topology_on X T. assume HU: U :e T. assume HV: V :e T. prove U :\/: V :e T. claim Hpairsub: {U,V} c= T. { "
12,binunion_open,5586,LATEX VERSION: The union of two open sets is open.,"Theorem binunion_open : forall X T U V:set, open_in X T U -> open_in X T V -> open_in X T (U :\/: V). let X T U V. assume HU: open_in X T U. assume HV: open_in X T V. prove open_in X T (U :\/: V). claim HTx: topology_on X T. { exact (andEL "
12,countably_infinite_implies_countable,5644,"LATEX VERSION: If X is countably infinite, then X is countable (at most countable).","Theorem countably_infinite_implies_countable : forall X:set, countably_infinite X -> countable X. let X. assume Heq: countably_infinite X. prove countable X. exact (equip_atleastp X omega Heq). Qed. "
12,countably_infinite_implies_infinite,5653,"LATEX VERSION: If X is countably infinite, then X is infinite.","Theorem countably_infinite_implies_infinite : forall X:set, countably_infinite X -> infinite X. let X. assume Heq: countably_infinite X. prove infinite X. claim Heq': equip omega X. { exact (equip_sym X omega Heq). } claim Hinj: atleastp om"
12,finite_countable,5666,LATEX VERSION: Every finite set is countable.,"Theorem finite_countable : forall X:set, finite X -> countable X. let X. assume Hfin. apply Hfin. let n. assume Hpair: n :e omega /\ equip X n. claim Hn : n :e omega. { exact (andEL (n :e omega) (equip X n) Hpair). } claim Heq : equip X n. "
12,countable_Empty,5685,LATEX VERSION: The empty set is countable.,Theorem countable_Empty : countable Empty. exact (Subq_atleastp Empty omega (Subq_Empty omega)). Qed. 
12,Subq_countable,5691,LATEX VERSION: A subset of a countable set is countable.,"Theorem Subq_countable : forall X Y:set, countable Y -> X c= Y -> countable X. let X Y. assume HcountY HsubXY. prove atleastp X omega. apply atleastp_tra X Y omega. - exact (Subq_atleastp X Y HsubXY). - exact HcountY. Qed. "
12,binintersect_countable_left,5701,LATEX VERSION: Any subset of a countable set is countable; in particular X∩Y is countable if X is countable.,"Theorem binintersect_countable_left : forall X Y:set, countable X -> countable (X :/\: Y). let X Y. assume HcountX: countable X. prove countable (X :/\: Y). apply (Subq_countable (X :/\: Y) X HcountX). exact (binintersect_Subq_1 X Y). Qed. "
12,setminus_countable,5712,LATEX VERSION: X\\A is countable if X is countable.,"Theorem setminus_countable : forall X A:set, countable X -> countable (X :\: A). let X A. assume HcountX: countable X. prove countable (X :\: A). apply (Subq_countable (X :\: A) X HcountX). exact (setminus_Subq X A). Qed. "
12,binunion_countable,5724,NOTE: This requires some form of choice or construction,"Theorem binunion_countable : forall X Y:set, countable X -> countable Y -> countable (X :\/: Y). let X Y. assume HcountX: countable X. assume HcountY: countable Y. prove countable (X :\/: Y). prove exists h : set -> set, inj (X :\/: Y) omeg"
12,Sigma_countable,5952,"LATEX VERSION: A countable union of countable sets is countable, encoded as a dependent sum with nat-pairing.","Theorem Sigma_countable : forall X:set, countable X -> forall Y:set->set, (forall x:set, x :e X -> countable (Y x)) -> countable (Sigma_ x :e X, Y x). let X. assume HX: countable X. let Y. assume HY: forall x:set, x :e X -> countable (Y x)."
12,setprod_countable,6270,LATEX VERSION: If X and Y are countable then X×Y is countable via nat-pairing of injections.,"Theorem setprod_countable : forall X Y:set, countable X -> countable Y -> countable (X :*: Y). let X Y. assume HX: countable X. assume HY: countable Y. prove countable (X :*: Y). prove exists h : set -> set, inj (X :*: Y) omega h. apply HX."
12,countable_complement_topology_on,6478,"LATEX VERSION: The countable complement collection T_c on X is a topology: ∅, X are open; arbitrary unions and finite intersections remain i","Theorem countable_complement_topology_on : forall X, topology_on X (countable_complement_topology X). let X. claim HEmptyOpen : Empty :e countable_complement_topology X. { exact (SepI (Power X) (fun U0 : set => countable (X :\: U0) \/ U0 = "
12,discrete_topology_on,6642,LATEX VERSION: The discrete topology on any set X satisfies the axioms of a topology.,"Theorem discrete_topology_on : forall X, topology_on X (discrete_topology X). let X. prove Power X c= Power X /\ Empty :e Power X /\ X :e Power X /\ (forall UFam :e Power (Power X), Union UFam :e Power X) /\ (forall U :e Power X, forall V :"
12,indiscrete_topology_on,6680,"LATEX VERSION: The trivial/indiscrete topology {∅, X} on any set X satisfies the topology axioms.","Theorem indiscrete_topology_on : forall X, topology_on X (indiscrete_topology X). let X. prove indiscrete_topology X c= Power X /\ Empty :e indiscrete_topology X /\ X :e indiscrete_topology X /\ (forall UFam :e Power (indiscrete_topology X)"
12,finite_complement_topology_on,6791,"LATEX VERSION: The finite complement collection T_f on X is a topology: ∅, X are open; arbitrary unions and finite intersections remain in T","Theorem finite_complement_topology_on : forall X, topology_on X (finite_complement_topology X). let X. claim HEmptyOpen : Empty :e finite_complement_topology X. { exact (SepI (Power X) (fun U0 : set => finite (X :\: U0) \/ U0 = Empty) Empty"
12,comparable_topologies_on_topology1,6985,"helper: unpack comparable_topologies_on, first topology_on","Theorem comparable_topologies_on_topology1 : forall X T1 T2:set, comparable_topologies_on X T1 T2 -> topology_on X T1. let X T1 T2. assume H: comparable_topologies_on X T1 T2. claim Hcore: topology_on X T1 /\ topology_on X T2. { exact (andE"
12,comparable_topologies_on_topology2,6997,"helper: unpack comparable_topologies_on, second topology_on","Theorem comparable_topologies_on_topology2 : forall X T1 T2:set, comparable_topologies_on X T1 T2 -> topology_on X T2. let X T1 T2. assume H: comparable_topologies_on X T1 T2. claim Hcore: topology_on X T1 /\ topology_on X T2. { exact (andE"
12,comparable_topologies_on_comparable,7009,"helper: unpack comparable_topologies_on, comparability predicate","Theorem comparable_topologies_on_comparable : forall X T1 T2:set, comparable_topologies_on X T1 T2 -> comparable_topologies T1 T2. let X T1 T2. assume H: comparable_topologies_on X T1 T2. exact (andER (topology_on X T1 /\ topology_on X T2) "
12,topology_eq_sym,7027,LATEX VERSION: Equality of topologies is symmetric.,"Theorem topology_eq_sym : forall X T1 T2:set, topology_eq X T1 T2 -> topology_eq X T2 T1. let X T1 T2. assume H. claim Hpair: topology_on X T1 /\ topology_on X T2. { exact (andEL (topology_on X T1 /\ topology_on X T2) (T1 = T2) H). } claim "
12,topology_eq_trans,7046,LATEX VERSION: Equality of topologies is transitive.,"Theorem topology_eq_trans : forall X T1 T2 T3:set, topology_eq X T1 T2 -> topology_eq X T2 T3 -> topology_eq X T1 T3. let X T1 T2 T3. assume H12 H23. claim H12pair: topology_on X T1 /\ topology_on X T2. { exact (andEL (topology_on X T1 /\ t"
12,topology_eq_refl,7072,LATEX VERSION: Any topology equals itself (with the requisite topology_on hypotheses).,"Theorem topology_eq_refl : forall X T:set, topology_on X T -> topology_eq X T T. let X T. assume HT. prove topology_on X T /\ topology_on X T /\ T = T. apply and3I. - exact HT. - exact HT. - reflexivity. Qed. "
12,strictly_finer_than_topology_topology1,7104,"helper: unpack strict fineness, topology_on on left","Theorem strictly_finer_than_topology_topology1 : forall X T' T:set, strictly_finer_than_topology X T' T -> topology_on X T'. let X T' T. assume H: strictly_finer_than_topology X T' T. claim Hcore: topology_on X T' /\ topology_on X T. { exac"
12,strictly_finer_than_topology_topology2,7116,"helper: unpack strict fineness, topology_on on right","Theorem strictly_finer_than_topology_topology2 : forall X T' T:set, strictly_finer_than_topology X T' T -> topology_on X T. let X T' T. assume H: strictly_finer_than_topology X T' T. claim Hcore: topology_on X T' /\ topology_on X T. { exact"
12,strictly_finer_than_topology_strict,7128,helper: unpack strict fineness predicate,"Theorem strictly_finer_than_topology_strict : forall X T' T:set, strictly_finer_than_topology X T' T -> strictly_finer_than T' T. let X T' T. assume H: strictly_finer_than_topology X T' T. exact (andER (topology_on X T' /\ topology_on X T) "
12,strictly_coarser_than_topology_strict,7138,helper: unpack strict coarseness predicate,"Theorem strictly_coarser_than_topology_strict : forall X T' T:set, strictly_coarser_than_topology X T' T -> strictly_coarser_than T' T. let X T' T. assume H: strictly_coarser_than_topology X T' T. exact (andER (topology_on X T' /\ topology_"
12,discrete_topology_finest,7171,LATEX VERSION: The discrete topology on X is finer than any other topology on X.,"Theorem discrete_topology_finest : forall X T:set, topology_on X T -> finer_than (discrete_topology X) T. let X T. assume HT. exact (topology_sub_Power X T HT). Qed. "
12,indiscrete_topology_coarsest,7179,LATEX VERSION: The indiscrete topology on X is coarser than any other topology on X.,"Theorem indiscrete_topology_coarsest : forall X T:set, topology_on X T -> coarser_than (indiscrete_topology X) T. let X T. assume HT. claim Hempty : Empty :e T. { exact (topology_has_empty X T HT). } claim HX : X :e T. { exact (topology_has"
12,finite_complement_topology_open_criterion,7216,"LATEX VERSION: In the finite complement topology, an open set U satisfies that X\\U is finite or U=∅.","Theorem finite_complement_topology_open_criterion : forall X U:set, open_in X (finite_complement_topology X) U -> finite (X :\: U) \/ U = Empty. let X U. assume Hopen. claim HUin : U :e finite_complement_topology X. { exact (andER (topology"
12,countable_complement_topology_open_iff,7255,"LATEX VERSION: In the countable complement topology, an open set U has X\\U countable or U=∅.","Theorem countable_complement_topology_open_iff : forall X U:set, open_in X (countable_complement_topology X) U -> countable (X :\: U) \/ U = Empty. let X U. assume Hopen. claim HUin : U :e countable_complement_topology X. { exact (andER (to"
12,countable_complement_topology_contains_empty,7266,LATEX VERSION: ∅ is open in the countable complement topology.,"Theorem countable_complement_topology_contains_empty : forall X:set, Empty :e countable_complement_topology X. let X. exact (SepI (Power X) (fun U0 : set => countable (X :\: U0) \/ U0 = Empty) Empty (Empty_In_Power X) (orIR (countable (X :\"
12,countable_complement_topology_contains_full,7274,LATEX VERSION: X is open in the countable complement topology.,"Theorem countable_complement_topology_contains_full : forall X:set, X :e countable_complement_topology X. let X. claim Hdiff_empty : X :\: X = Empty. { apply Empty_Subq_eq. let x. assume Hx. claim HxX : x :e X. { exact (setminusE1 X X x Hx)"
12,countable_complement_finer_than_finite_complement,7294,LATEX VERSION: The countable complement topology is finer than the finite complement topology.,"Theorem countable_complement_finer_than_finite_complement : forall X:set, finer_than (countable_complement_topology X) (finite_complement_topology X). let X. prove finite_complement_topology X c= countable_complement_topology X. let U. assu"
12,indiscrete_coarser_than_countable_complement,7327,LATEX VERSION: The indiscrete topology is coarser than the countable complement topology.,"Theorem indiscrete_coarser_than_countable_complement : forall X:set, coarser_than (indiscrete_topology X) (countable_complement_topology X). let X. prove indiscrete_topology X c= countable_complement_topology X. let U. assume HU: U :e indis"
12,lemma_union_of_topology_family_open,7354,"LATEX VERSION: In any topology, the union of any subfamily of open sets is open.","Theorem lemma_union_of_topology_family_open : forall X T UFam:set, topology_on X T -> UFam :e Power T -> Union UFam :e T. let X T UFam. assume HT Hfam. exact (topology_union_axiom X T HT UFam Hfam). Qed. "
12,lemma_intersection_two_open,7364,"LATEX VERSION: In any topology, the intersection of two open sets is open (and hence any finite intersection).","Theorem lemma_intersection_two_open : forall X T U V:set, topology_on X T -> U :e T -> V :e T -> U :/\: V :e T. let X T U V. assume HT HU HV. exact (topology_binintersect_closed X T U V HT HU HV). Qed. "
12,ex13_2_compare_nine_topologies,15468,LATEX VERSION: Exercise 2 asks to compare the nine topologies in Example 1 of §12 by inclusion (finer/coarser).,Theorem ex13_2_compare_nine_topologies : topology_on abc_set top_abc_1 /\ topology_on abc_set top_abc_2 /\ topology_on abc_set top_abc_3 /\ topology_on abc_set top_abc_4 /\ topology_on abc_set top_abc_5 /\ topology_on abc_set top_abc_6 /\ t
12,ex13_3a_Tc_topology,15798,LATEX VERSION: Exercise 3: The countable-complement topology Tc on X is a topology.,"Theorem ex13_3a_Tc_topology : forall X:set, topology_on X (countable_complement_topology X). let X. exact (countable_complement_topology_on X). Qed. "
12,ex13_3a_countable_complement_open,15805,"LATEX VERSION: Exercise 3(a): in the countable-complement topology, any nonempty open set has countable complement.","Theorem ex13_3a_countable_complement_open : forall X:set, forall U :e countable_complement_topology X, U <> Empty -> countable (X :\: U). let X U. assume HU: U :e countable_complement_topology X. assume Hnemp: U <> Empty. prove countable (X"
12,ex13_3a_union_helper,15825,LATEX VERSION: Exercise 3(a): verify the topology axiom that unions of open sets are open for the countable-complement topology.,"Theorem ex13_3a_union_helper : forall X:set, forall UFam :e Power (countable_complement_topology X), Union UFam :e countable_complement_topology X. let X UFam. assume HUFam: UFam :e Power (countable_complement_topology X). prove Union UFam "
12,ex13_3b_Tinfty_not_topology,16001,"LATEX VERSION: Exercise 3: For infinite X, Tinfty is not a topology (union-closure fails).","Theorem ex13_3b_Tinfty_not_topology : forall X:set, infinite X -> ~topology_on X (infinite_complement_family X). let X. assume HinfX: infinite X. assume Htop: topology_on X (infinite_complement_family X). prove False. claim HUnionClosure: f"
13,lemma_topology_from_basis,7559,LATEX VERSION: The collection generated by a basis indeed satisfies the topology axioms.,"Theorem lemma_topology_from_basis : forall X B:set, basis_on X B -> topology_on X (generated_topology X B). let X B. assume HBasis. claim HBleft : B c= Power X /\ (forall x :e X, exists b :e B, x :e b). { exact (andEL (B c= Power X /\ (fora"
13,generated_topology_finer_weak,7771,NOTE: This does not require B to satisfy the basis axioms; it is a general “generated topology is minimal” direction.,"Theorem generated_topology_finer_weak : forall X B T:set, topology_on X T -> (forall b :e B, b :e T) -> finer_than T (generated_topology X B). let X B T. assume HT: topology_on X T. assume HBsub: forall b :e B, b :e T. prove finer_than T (g"
13,open_sets_as_unions_of_basis,7877,"LATEX VERSION: Lemma 13.1: For a basis B on X, every open set is a union of elements of B.","Theorem open_sets_as_unions_of_basis : forall X B:set, basis_on X B -> forall U:set, open_in X (generated_topology X B) U -> exists Fam :e Power B, Union Fam = U. let X B. assume HBasis. claim HBsub : B c= Power X. { exact (andEL (B c= Powe"
13,basis_generates_open_sets,7929,"LATEX VERSION: Conversely, any union of basis elements is open in the topology generated by the basis.","Theorem basis_generates_open_sets : forall X B:set, basis_on X B -> forall U:set, (exists Fam :e Power B, Union Fam = U) -> open_in X (generated_topology X B) U. let X B. assume HBasis. claim HBsub : B c= Power X. { exact (andEL (B c= Power"
13,open_as_union_of_basis_elements,7994,"LATEX VERSION: Corollary: For U open in topology generated by B, U equals the union of all basis elements contained in U.","Theorem open_as_union_of_basis_elements : forall X B:set, basis_on X B -> forall U:set, open_in X (generated_topology X B) U -> U = Union {b :e B|b c= U}. let X B. assume HBasis. let U. assume HUopen. claim HUtop : U :e generated_topology X"
13,basis_refines_topology,8032,"LATEX VERSION: Lemma 13.2: If every open set of topology T on X is locally contained in some element of C⊂T, then C is a basis and generates","Theorem basis_refines_topology : forall X T C:set, topology_on X T -> (forall c :e C, c :e T) -> (forall U :e T, forall x :e U, exists Cx :e C, x :e Cx /\ Cx c= U) -> basis_on X C /\ generated_topology X C = T. let X T C. assume Htop HCsub "
