sec,name,line,banner,stmt_preview
30,convergent_sequence_implies_closure,128121,"LATEX VERSION: If a sequence in A converges to x, then x is in the closure of A (no countability needed).","Theorem convergent_sequence_implies_closure : forall X Tx A x:set, topology_on X Tx -> A c= X -> (exists seq:set, sequence_in seq A /\ converges_to X Tx seq x) -> x :e closure_of X Tx A. let X Tx A x. assume HTx: topology_on X Tx. assume HA"
30,first_countable_sequences_detect_continuity,128510,FIXED: Correct convergence target and image limit: if x_n converges to x then f(x_n) converges to f(x).,"Theorem first_countable_sequences_detect_continuity : forall X Tx Y Ty f:set, topology_on X Tx -> topology_on Y Ty -> (continuous_map X Tx Y Ty f -> forall x seq:set, sequence_on seq X -> converges_to X Tx seq x -> converges_to Y Ty (map_se"
30,second_countable_implies_first_countable,128606,helper: second countable implies first countable,"Theorem second_countable_implies_first_countable : forall X Tx:set, second_countable_space X Tx -> first_countable_space X Tx. let X Tx. assume Hscc: second_countable_space X Tx. prove first_countable_space X Tx. claim HTx: topology_on X Tx"
30,R_standard_topology_second_countable,128713,LATEX VERSION: The real line with its standard topology has a countable basis.,"Theorem R_standard_topology_second_countable : second_countable_space R R_standard_topology. prove second_countable_space R R_standard_topology. prove topology_on R R_standard_topology /\ exists B:set, basis_on R B /\ countable_set B /\ bas"
30,euclidean_spaces_second_countable,128740,"LATEX VERSION: Euclidean spaces have a countable basis, hence are second countable.","Theorem euclidean_spaces_second_countable : forall n:set, n :e omega -> second_countable_space (euclidean_space n) (euclidean_topology n). let n. assume Hn: n :e omega. prove second_countable_space (euclidean_space n) (euclidean_topology n)"
30,second_countable_discrete_subspace_countable,129327,"LATEX VERSION: In a second-countable space, every discrete subspace is countable.","Theorem second_countable_discrete_subspace_countable : forall X Tx A:set, second_countable_space X Tx -> discrete_subspace X Tx A -> countable_set A. let X Tx A. assume Hsc: second_countable_space X Tx. assume Hdisc: discrete_subspace X Tx "
30,binary_sequences_Romega_uncountable,129475,LATEX VERSION: The set of binary sequences is uncountable because Power omega injects into it via characteristic functions.,Theorem binary_sequences_Romega_uncountable : ~ countable_set binary_sequences_Romega. prove ~ countable_set binary_sequences_Romega. assume Hcount: countable_set binary_sequences_Romega. apply Hcount. let g. assume Hg: inj binary_sequences
30,binary_sequences_Romega_discrete_in_uniform_topology,129971,"LATEX VERSION: In the uniform topology on R omega, any two distinct binary sequences have distance 1, so the subspace is discrete.",Theorem binary_sequences_Romega_discrete_in_uniform_topology : discrete_subspace real_sequences uniform_topology binary_sequences_Romega. prove discrete_subspace real_sequences uniform_topology binary_sequences_Romega. prove binary_sequence
30,Romega_uniform_first_not_second_countable,130040,"LATEX VERSION: In the uniform topology, R omega is metrizable (hence first countable) but has no countable basis.",Theorem Romega_uniform_first_not_second_countable : first_countable_space real_sequences uniform_topology /\ ~ second_countable_space real_sequences uniform_topology. prove first_countable_space real_sequences uniform_topology /\ ~ second_c
30,countability_axioms_subspace_product,130058,FIXED: Product clauses quantify i only over i:e I (not all sets).,"Theorem countability_axioms_subspace_product : forall X Tx:set, topology_on X Tx -> (forall A:set, A c= X -> first_countable_space X Tx -> first_countable_space A (subspace_topology X Tx A)) /\ (forall A:set, A c= X -> second_countable_spac"
30,separable_spaceI,130978,"LATEX VERSION: If D is countable and dense, then the space is separable.","Theorem separable_spaceI : forall X Tx D:set, countable_set D -> dense_in D X Tx -> separable_space X Tx. let X Tx D. assume Hcount: countable_set D. assume Hdense: dense_in D X Tx. prove exists D0:set, countable_set D0 /\ dense_in D0 X Tx."
30,separable_spaceE,130992,"LATEX VERSION: If a space is separable, it has a countable dense subset.","Theorem separable_spaceE : forall X Tx:set, separable_space X Tx -> exists D:set, countable_set D /\ dense_in D X Tx. let X Tx. assume Hsep: separable_space X Tx. exact Hsep. Qed. "
30,countable_dense_subset_implies_separable,131006,"LATEX VERSION: If X has a countable dense subset, then X is separable.","Theorem countable_dense_subset_implies_separable : forall X Tx:set, countable_dense_subset X Tx -> separable_space X Tx. let X Tx. assume Hex: countable_dense_subset X Tx. apply Hex. let D. assume HD: D c= X /\ countable D /\ dense_in D X T"
30,closure_of_binintersect_space_eq,131053,"LATEX VERSION: For A ⊆ any set, cl_X(A∩X)=cl_X(A).","Theorem closure_of_binintersect_space_eq : forall X Tx A:set, topology_on X Tx -> closure_of X Tx (A :/\: X) = closure_of X Tx A. let X Tx A. assume HTx: topology_on X Tx. apply set_ext. - let x. assume Hx: x :e closure_of X Tx (A :/\: X). "
30,separable_implies_countable_dense_subset,131133,LATEX VERSION: If X is separable then it has a countable dense subset D⊆X.,"Theorem separable_implies_countable_dense_subset : forall X Tx:set, topology_on X Tx -> separable_space X Tx -> countable_dense_subset X Tx. let X Tx. assume HTx: topology_on X Tx. assume Hsep: separable_space X Tx. prove exists D1:set, D1 "
30,dense_in_superset,131174,"LATEX VERSION: If A is dense in X and A ⊆ B ⊆ X, then B is dense in X.","Theorem dense_in_superset : forall A B X Tx:set, topology_on X Tx -> A c= B -> B c= X -> dense_in A X Tx -> dense_in B X Tx. let A B X Tx. assume HTx: topology_on X Tx. assume HAB: A c= B. assume HBX: B c= X. assume HdA: dense_in A X Tx. pr"
30,meets_nonempty_open_implies_dense_in,131204,"LATEX VERSION: If A meets every nonempty open set, then A is dense in X.","Theorem meets_nonempty_open_implies_dense_in : forall A X Tx:set, topology_on X Tx -> (forall U:set, U :e Tx -> U <> Empty -> U :/\: A <> Empty) -> dense_in A X Tx. let A X Tx. assume HTx: topology_on X Tx. assume Hmeet: forall U:set, U :e "
30,countable_basis_implies_Lindelof,131235,LATEX VERSION: A second-countable space is Lindelöf (every open cover has countable subcover).,"Theorem countable_basis_implies_Lindelof : forall X Tx:set, topology_on X Tx -> second_countable_space X Tx -> forall U:set, open_cover X Tx U -> exists V:set, countable_subcollection V U /\ covers X V. let X Tx. assume HTx: topology_on X T"
30,second_countable_implies_Lindelof_space,131347,LATEX VERSION: Theorem 30.3(a): If X has a countable basis then every open cover has a countable subcover.,"Theorem second_countable_implies_Lindelof_space : forall X Tx:set, second_countable_space X Tx -> Lindelof_space X Tx. let X Tx. assume Hscc: second_countable_space X Tx. prove Lindelof_space X Tx. claim HTx: topology_on X Tx. { exact (andE"
30,countable_basis_implies_separable,131365,LATEX VERSION: Second-countable spaces are separable (have countable dense subset).,"Theorem countable_basis_implies_separable : forall X Tx:set, topology_on X Tx -> second_countable_space X Tx -> exists D:set, countable_set D /\ dense_in D X Tx. let X Tx. assume HTx: topology_on X Tx. assume Hscc: second_countable_space X "
30,countable_basis_implies_separable_space,131458,LATEX VERSION: Second-countable spaces are separable.,"Theorem countable_basis_implies_separable_space : forall X Tx:set, topology_on X Tx -> second_countable_space X Tx -> separable_space X Tx. let X Tx. assume HTx: topology_on X Tx. assume Hscc: second_countable_space X Tx. prove separable_sp"
30,Sorgenfrey_line_rationals_dense,131698,"LATEX VERSION: The rationals are dense in R_l: every basic interval [a,b) contains a rational.",Theorem Sorgenfrey_line_rationals_dense : dense_in rational_numbers Sorgenfrey_line Sorgenfrey_topology. prove dense_in rational_numbers Sorgenfrey_line Sorgenfrey_topology. prove closure_of Sorgenfrey_line Sorgenfrey_topology rational_numb
30,disjoint_open_family_countable_of_dense,131797,"LATEX VERSION: In a space with a countable dense subset D, any pairwise disjoint family of nonempty open sets is countable.","Theorem disjoint_open_family_countable_of_dense : forall X Tx D Fam:set, topology_on X Tx -> dense_in D X Tx -> countable_set D -> Fam c= Tx -> (forall U:set, U :e Fam -> U <> Empty) -> pairwise_disjoint Fam -> countable_set Fam. let X Tx D"
30,Sorgenfrey_line_countability,132846,"LATEX VERSION: R_l is first countable, separable, and Lindelof, but not second countable.",Theorem Sorgenfrey_line_countability : first_countable_space Sorgenfrey_line Sorgenfrey_topology /\ dense_in rational_numbers Sorgenfrey_line Sorgenfrey_topology /\ Lindelof_space Sorgenfrey_line Sorgenfrey_topology /\ ~ second_countable_sp
30,Sorgenfrey_plane_rational_points_countable,132878,helper: D is countable,Theorem Sorgenfrey_plane_rational_points_countable : countable_set Sorgenfrey_plane_rational_points. prove countable_set Sorgenfrey_plane_rational_points. prove countable Sorgenfrey_plane_rational_points. claim HQ: countable rational_number
30,Sorgenfrey_plane_rational_points_dense,132889,"LATEX VERSION: The set QxQ is dense in R_l^2: every basic set [a,b)x[c,d) meets QxQ.",Theorem Sorgenfrey_plane_rational_points_dense : dense_in Sorgenfrey_plane_rational_points (setprod Sorgenfrey_line Sorgenfrey_line) Sorgenfrey_plane_topology. prove dense_in Sorgenfrey_plane_rational_points (setprod Sorgenfrey_line Sorgenf
30,metric_topology_one_point_sets_closed,133013,"LATEX VERSION: In a metric space, singletons are closed (metric spaces are T1).","Theorem metric_topology_one_point_sets_closed : forall X d:set, metric_on X d -> one_point_sets_closed X (metric_topology X d). let X d. assume Hm: metric_on X d. prove one_point_sets_closed X (metric_topology X d). prove topology_on X (met"
30,Hausdorff_one_point_sets_closed,133101,"LATEX VERSION: In a Hausdorff space, every singleton is closed (Hausdorff implies T1).","Theorem Hausdorff_one_point_sets_closed : forall X Tx:set, Hausdorff_space X Tx -> one_point_sets_closed X Tx. let X Tx. assume HH: Hausdorff_space X Tx. prove one_point_sets_closed X Tx. prove topology_on X Tx /\ forall x:set, x :e X -> cl"
30,ordered_square_has_finite_subcover,143879,NOTE: This is standard but nontrivial; we keep the compactness proof admitted and derive Lindelöf from it.,"Theorem ordered_square_has_finite_subcover : forall Fam:set, open_cover_of ordered_square ordered_square_topology Fam -> has_finite_subcover ordered_square ordered_square_topology Fam. let Fam. assume Hcover: open_cover_of ordered_square or"
30,ordered_square_compact,146401,"Next step: case split on which basis-shape bb has, and use it to push Good past x0.","Theorem ordered_square_compact : compact_space ordered_square ordered_square_topology. prove compact_space ordered_square ordered_square_topology. prove topology_on ordered_square ordered_square_topology /\ forall Fam:set, open_cover_of ord"
30,ordered_square_Lindelof,146413,"Next step: case split on which basis-shape bb has, and use it to push Good past x0.",Theorem ordered_square_Lindelof : Lindelof_space ordered_square ordered_square_topology. exact (compact_space_implies_Lindelof_space ordered_square ordered_square_topology ordered_square_compact). Qed. 
30,ordered_square_Lindelof_sketch,146417,"Next step: case split on which basis-shape bb has, and use it to push Good past x0.",Theorem ordered_square_Lindelof_sketch : Lindelof_space ordered_square ordered_square_topology. exact ordered_square_Lindelof. Qed. 
30,ordered_square_A_slice_open,146459,"LATEX VERSION: For each x, the interval ((x,0),(x,1)) in the dictionary order intersects A as {x}×(0,1).","Theorem ordered_square_A_slice_open : forall x:set, x :e unit_interval -> setprod {x} (open_interval 0 1) :e ordered_square_A_topology. let x. assume Hx: x :e unit_interval. set a := (x,0). set b := (x,1). set V := {p :e ordered_square | or"
30,continuous_preimage_Gdelta,310013,"LATEX VERSION: If f:X→Y is continuous and A⊆Y is G_delta, then f^{-1}(A) is G_delta in X.","Theorem continuous_preimage_Gdelta : forall X Tx Y Ty f A:set, continuous_map X Tx Y Ty f -> Gdelta_in Y Ty A -> Gdelta_in X Tx (preimage_of X f A). let X Tx Y Ty f A. assume Hcont: continuous_map X Tx Y Ty f. assume HG: Gdelta_in Y Ty A. c"
30,ex30_1a_onepoint_Gdelta_firstcountable_T1,323960,"LATEX VERSION: In a first-countable T₁ space, every one-point set is a G_δ set.","Theorem ex30_1a_onepoint_Gdelta_firstcountable_T1 : forall X Tx x:set, first_countable_space X Tx -> T1_space X Tx -> x :e X -> Gdelta_in X Tx (Sing x). let X Tx x. assume Hfc: first_countable_space X Tx. assume HT1: T1_space X Tx. assume H"
30,ex30_1b_AF_topology_on,324154,helper for §30 Exercise 1b: the Arens Fort topology is a topology on omega×omega,"Theorem ex30_1b_AF_topology_on : topology_on ex30_1b_AF_X ex30_1b_AF_Tx. prove ex30_1b_AF_Tx c= Power ex30_1b_AF_X /\ Empty :e ex30_1b_AF_Tx /\ ex30_1b_AF_X :e ex30_1b_AF_Tx /\ (forall UFam :e Power ex30_1b_AF_Tx, Union UFam :e ex30_1b_AF_T"
30,ex30_1b_AF_Un_open,324364,helper for §30 Exercise 1b: each Un n is open,"Theorem ex30_1b_AF_Un_open : forall n:set, n :e omega -> open_in ex30_1b_AF_X ex30_1b_AF_Tx ({ex30_1b_AF_p} :\/: {w :e ex30_1b_AF_X | n c= w 1}). let n. assume HnO: n :e omega. set Un := {ex30_1b_AF_p} :\/: {w :e ex30_1b_AF_X | n c= w 1}. p"
30,ex30_1b_AF_singleton_open,324416,helper for §30 Exercise 1b: singletons away from p are open,"Theorem ex30_1b_AF_singleton_open : forall x:set, x :e ex30_1b_AF_X -> ~(x = ex30_1b_AF_p) -> open_in ex30_1b_AF_X ex30_1b_AF_Tx (Sing x). let x. assume HxX: x :e ex30_1b_AF_X. assume Hneq: ~(x = ex30_1b_AF_p). apply open_inI. - exact ex30_"
30,ex30_1b_AF_singleton_Gdelta_not_p,324444,helper for §30 Exercise 1b: G_delta for isolated points (x not equal p),"Theorem ex30_1b_AF_singleton_Gdelta_not_p : forall x:set, x :e ex30_1b_AF_X -> ~(x = ex30_1b_AF_p) -> Gdelta_in ex30_1b_AF_X ex30_1b_AF_Tx (Sing x). let x. assume HxX: x :e ex30_1b_AF_X. assume Hneq: ~(x = ex30_1b_AF_p). claim Hex: exists F"
30,ex30_1b_AF_singleton_Gdelta_p,324479,helper for §30 Exercise 1b: G_delta for p,"Theorem ex30_1b_AF_singleton_Gdelta_p : Gdelta_in ex30_1b_AF_X ex30_1b_AF_Tx (Sing ex30_1b_AF_p). set Un := (fun n:set => {ex30_1b_AF_p} :\/: {w :e ex30_1b_AF_X | n c= w 1}). set Fam := {Un n | n :e omega}. claim Hex: exists Fam0:set, count"
30,ex30_1b_AF_not_first_countable,324574,helper for §30 Exercise 1b: the Arens Fort example is not first-countable,Theorem ex30_1b_AF_not_first_countable : ~ first_countable_space ex30_1b_AF_X ex30_1b_AF_Tx. assume Hfc: first_countable_space ex30_1b_AF_X ex30_1b_AF_Tx. prove False. apply Hfc. assume HTx Hallx. claim HpX: ex30_1b_AF_p :e ex30_1b_AF_X. { 
30,ex30_1b_Gdelta_not_firstcountable_exists,324830,LATEX VERSION: There exists a space where every one-point set is G_δ but which doesn't satisfy the first countability axiom.,"Theorem ex30_1b_Gdelta_not_firstcountable_exists : exists X:set, exists Tx:set, topology_on X Tx /\ (forall x:set, x :e X -> Gdelta_in X Tx (Sing x)) /\ ~ first_countable_space X Tx. witness ex30_1b_AF_X. witness ex30_1b_AF_Tx. apply andI. "
30,ex30_2_basis_contains_countable,324846,"LATEX VERSION: If X has a countable basis, then every basis for X contains a countable basis.","Theorem ex30_2_basis_contains_countable : forall X Tx:set, forall Basis:set, second_countable_space X Tx -> basis_generates X Basis Tx -> exists CountableSub:set, CountableSub c= Basis /\ countable CountableSub /\ basis_generates X Countabl"
30,ex30_3_uncountably_many_limit_points,325086,"FIXED: Use limit_point_of X Tx A x (space, topology, set, point), not a permuted argument order.","Theorem ex30_3_uncountably_many_limit_points : forall X Tx A:set, second_countable_space X Tx -> A c= X -> ~ countable A -> ~ countable {x :e A | limit_point_of X Tx A x}. let X Tx A. assume Hsc: second_countable_space X Tx. assume HA: A c="
30,ex30_6a_Rl_not_metrizable,326465,LATEX VERSION: The Sorgenfrey line ℝ_ℓ is not metrizable.,Theorem ex30_6a_Rl_not_metrizable : ~ metrizable R R_lower_limit_topology. prove ~ metrizable R R_lower_limit_topology. assume Hmet: metrizable R R_lower_limit_topology. prove False. claim HL: Lindelof_space R R_lower_limit_topology. { prov
30,ex30_6b_ordered_square_not_metrizable,326494,LATEX VERSION: The ordered square is not metrizable.,Theorem ex30_6b_ordered_square_not_metrizable : ~ metrizable ordered_square ordered_square_topology. prove ~ metrizable ordered_square ordered_square_topology. assume Hmet: metrizable ordered_square ordered_square_topology. prove False. app
30,ex30_7_SOmega_Sbar_Omega_countability,326572,Uses the existing SOmega_topology and SbarOmega_topology defined earlier in this section.,"Theorem ex30_7_SOmega_Sbar_Omega_countability : (first_countable_space S_Omega SOmega_topology /\ ~ second_countable_space S_Omega SOmega_topology /\ ~ Lindelof_space S_Omega SOmega_topology /\ ~ (exists D:set, D c= S_Omega /\ countable D /"
30,ex30_8_Romega_uniform_countability,326584,LATEX VERSION: Determine which countability axioms R^ω satisfies in the uniform topology.,"Theorem ex30_8_Romega_uniform_countability : first_countable_space real_sequences uniform_topology /\ ~ second_countable_space real_sequences uniform_topology /\ ~ Lindelof_space real_sequences uniform_topology /\ ~ (exists D:set, D c= real"
30,ex30_9a_closed_Lindelof,326643,"LATEX VERSION: If A is closed in Lindelöf space X, then A is Lindelöf.","Theorem ex30_9a_closed_Lindelof : forall X Tx A:set, Lindelof_space X Tx -> closed_in X Tx A -> Lindelof_space A (subspace_topology X Tx A). let X Tx A. assume HL: Lindelof_space X Tx. assume Hclosed: closed_in X Tx A. prove Lindelof_space "
30,ex30_9b_dense_not_countable_dense,326857,"LATEX VERSION: Show by example that if X has a countable dense subset, a closed subspace A need not have a countable dense subset.","Theorem ex30_9b_dense_not_countable_dense : exists X:set, exists Tx:set, exists A:set, (exists D:set, D c= X /\ countable D /\ dense_in D X Tx) /\ closed_in X Tx A /\ ~ (exists DA:set, DA c= A /\ countable DA /\ dense_in DA A (subspace_topo"
30,ex30_10_product_countable_dense,326933,"LATEX VERSION: If X is countable product of spaces with countable dense subsets, then X has one.","Theorem ex30_10_product_countable_dense : forall Idx:set, forall Fam:set, countable Idx -> (forall i:set, i :e Idx -> exists Xi:set, exists Txi:set, exists Di:set, apply_fun Fam i = (Xi, Txi) /\ topology_on Xi Txi /\ Di c= Xi /\ countable D"
30,ex30_11a_image_Lindelof,327687,FIXED: Use image_of f X for the image set; apply_fun is for elements.,"Theorem ex30_11a_image_Lindelof : forall X Tx Y Ty f:set, Lindelof_space X Tx -> continuous_map X Tx Y Ty f -> Lindelof_space (image_of f X) (subspace_topology Y Ty (image_of f X)). let X Tx Y Ty f. assume HLX: Lindelof_space X Tx. assume H"
30,ex30_11b_image_countable_dense,327925,FIXED: apply_fun f X should be image_of f X (same error pattern).,"Theorem ex30_11b_image_countable_dense : forall X Tx Y Ty f:set, (exists D:set, D c= X /\ countable D /\ dense_in D X Tx) -> continuous_map X Tx Y Ty f -> exists Df:set, Df c= (image_of f X) /\ countable Df /\ dense_in Df (image_of f X) (su"
30,continuous_image_countable_dense_subset,328075,"LATEX VERSION: If f:X→Y is continuous and X has a countable dense subset, then f(X) does too.","Theorem continuous_image_countable_dense_subset : forall X Tx Y Ty f:set, countable_dense_subset X Tx -> continuous_map X Tx Y Ty f -> countable_dense_subset (image_of f X) (subspace_topology Y Ty (image_of f X)). let X Tx Y Ty f. assume Hc"
30,continuous_image_separable_space,328087,"LATEX VERSION: If f:X→Y is continuous and X is separable, then f(X) is separable (in the subspace topology).","Theorem continuous_image_separable_space : forall X Tx Y Ty f:set, separable_space X Tx -> continuous_map X Tx Y Ty f -> separable_space (image_of f X) (subspace_topology Y Ty (image_of f X)). let X Tx Y Ty f. assume Hsep: separable_space X"
30,ex30_12a_open_map_first_countable,328107,FIXED: apply_fun f X should be image_of f X (same error pattern).,"Theorem ex30_12a_open_map_first_countable : forall X Tx Y Ty f:set, first_countable_space X Tx -> continuous_map X Tx Y Ty f -> open_map X Tx Y Ty f -> first_countable_space (image_of f X) (subspace_topology Y Ty (image_of f X)). let X Tx Y"
30,ex30_12b_open_map_second_countable,328294,FIXED: apply_fun f X should be image_of f X (same error pattern).,"Theorem ex30_12b_open_map_second_countable : forall X Tx Y Ty f:set, second_countable_space X Tx -> continuous_map X Tx Y Ty f -> open_map X Tx Y Ty f -> second_countable_space (image_of f X) (subspace_topology Y Ty (image_of f X)). let X T"
30,ex30_13_disjoint_open_sets_countable,328477,"LATEX VERSION: If X has countable dense subset, every collection of disjoint open sets in X is countable.","Theorem ex30_13_disjoint_open_sets_countable : forall X Tx:set, (exists D:set, D c= X /\ countable D /\ dense_in D X Tx) -> forall Fam:set, (forall U:set, U :e Fam -> open_in X Tx U) -> (forall U V:set, U :e Fam -> V :e Fam -> U <> V -> U :"
30,ex30_14_product_Lindelof_compact,328631,"LATEX VERSION: If X is Lindelöf and Y is compact, then X × Y is Lindelöf.","Theorem ex30_14_product_Lindelof_compact : forall X Tx Y Ty:set, Lindelof_space X Tx -> compact_space Y Ty -> Lindelof_space (setprod X Y) (product_topology X Tx Y Ty). let X Tx Y Ty. assume HX: Lindelof_space X Tx. assume HY: compact_space"
30,graphify_on_unit_interval_in_power_real,329046,LATEX VERSION: Any function f:I->R defines a point of the product space R^I by x↦f(x).,"Theorem graphify_on_unit_interval_in_power_real : forall f:set, function_on f unit_interval R -> graphify_on unit_interval f :e power_real unit_interval. let f. assume Hf: function_on f unit_interval R. prove graphify_on unit_interval f :e "
30,graphify_on_unit_interval_in_C_I_R,329085,"LATEX VERSION: Replacing a relation f by its graph x↦f(x) does not change any inverse images, so continuity is preserved.","Theorem graphify_on_unit_interval_in_C_I_R : forall f:set, f :e C_I_R -> graphify_on unit_interval f :e C_I_R. let f. assume Hf: f :e C_I_R. prove graphify_on unit_interval f :e C_I_R. apply (SepI (function_space unit_interval R) (fun f0:se"
30,ex30_16a_product_RI_countable_dense,335688,"LATEX VERSION: The product space ℝ^I, where I=[0,1], has a countable dense subset.","Theorem ex30_16a_product_RI_countable_dense : exists D:set, D c= product_space unit_interval (const_space_family unit_interval R R_standard_topology) /\ countable D /\ dense_in D (product_space unit_interval (const_space_family unit_interva"
30,ex30_16b_large_product_no_countable_dense,335699,"LATEX VERSION: If J has cardinality > 𝒫(ℤ₊), then ℝ^J does not have countable dense subset.","Theorem ex30_16b_large_product_no_countable_dense : forall J:set, atleastp (Power omega) J -> ~ equip J (Power omega) -> ~ (exists D:set, D c= product_space J (const_space_family J R R_standard_topology) /\ countable D /\ dense_in D (produc"
30,ex30_17_Romega_box_countability,335721,LATEX VERSION: Consider Q^infty as a subspace of R^omega in the box topology.,Theorem ex30_17_Romega_box_countability : (first_countable_space Q_infty Q_infty_topology \/ ~ first_countable_space Q_infty Q_infty_topology) /\ (second_countable_space Q_infty Q_infty_topology \/ ~ second_countable_space Q_infty Q_infty_t
30,ex30_18_first_countable_group_countable_dense_second_countable,335743,LATEX VERSION: A first countable topological group with a countable dense subset is second countable.,"Theorem ex30_18_first_countable_group_countable_dense_second_countable : forall G Tg:set, topological_group G Tg -> first_countable_space G Tg -> (exists D:set, D c= G /\ countable D /\ dense_in D G Tg) -> second_countable_space G Tg. let G"
30,ex30_18_first_countable_group_countable_basis,336284,"LATEX VERSION: If G is first-countable topological group with countable dense subset or Lindelöf, then G has countable basis.","Theorem ex30_18_first_countable_group_countable_basis : forall G Tg:set, topological_group G Tg -> first_countable_space G Tg -> ((exists D:set, D c= G /\ countable D /\ dense_in D G Tg) \/ Lindelof_space G Tg) -> second_countable_space G T"
31,normal_space_topology_on,133130,LATEX VERSION: A normal space is in particular a topological space (used implicitly in the definitions).,"Theorem normal_space_topology_on : forall X Tx:set, normal_space X Tx -> topology_on X Tx. let X Tx. assume Hnorm: normal_space X Tx. prove topology_on X Tx. claim Hone: one_point_sets_closed X Tx. { exact (andEL (one_point_sets_closed X Tx"
31,regular_space_topology_on,133148,LATEX VERSION: A regular space is in particular a topological space (used implicitly in the definitions).,"Theorem regular_space_topology_on : forall X Tx:set, regular_space X Tx -> topology_on X Tx. let X Tx. assume Hreg: regular_space X Tx. prove topology_on X Tx. claim Hone: one_point_sets_closed X Tx. { exact (andEL (one_point_sets_closed X "
31,regular_space_open_nbhd_closure_sub,133167,"LATEX VERSION: If x is in an open set U, then there exists an open V with x in V and cl(V) contained in U.","Theorem regular_space_open_nbhd_closure_sub : forall X Tx U x:set, regular_space X Tx -> U :e Tx -> x :e U -> exists V:set, V :e Tx /\ x :e V /\ closure_of X Tx V c= U. let X Tx U x. assume Hreg: regular_space X Tx. assume HU: U :e Tx. assu"
