sec,name,line,banner,stmt_preview
18,const_fun_continuous_total,68575,LATEX VERSION: Constant functions are continuous.,"Theorem const_fun_continuous_total : forall X Tx Y Ty x:set, topology_on X Tx -> topology_on Y Ty -> x :e Y -> continuous_map_total X Tx Y Ty (const_fun X x). let X Tx Y Ty x. assume HTx: topology_on X Tx. assume HTy: topology_on Y Ty. assu"
18,continuous_preserves_closed,68600,"LATEX VERSION: If f is continuous, then the inverse image of a closed set is closed.","Theorem continuous_preserves_closed : forall X Tx Y Ty f:set, continuous_map X Tx Y Ty f -> forall C:set, closed_in Y Ty C -> closed_in X Tx (preimage_of X f C). let X Tx Y Ty f. assume Hcont: continuous_map X Tx Y Ty f. claim Hpreimg: fora"
18,continuous_local_neighborhood,68684,"LATEX VERSION: A neighborhood formulation: for x in X and neighborhood V of f(x), there is a neighborhood U of x mapped into V.","Theorem continuous_local_neighborhood : forall X Tx Y Ty f:set, topology_on X Tx -> topology_on Y Ty -> function_on f X Y -> (forall V:set, V :e Ty -> preimage_of X f V :e Tx) -> forall x:set, x :e X -> forall V:set, V :e Ty -> apply_fun f "
18,topology_elem_of_local_neighborhoods,68712,LATEX VERSION: U is open if for every x in U there is an open set V with x in V subset U.,"Theorem topology_elem_of_local_neighborhoods : forall X Tx U:set, topology_on X Tx -> U c= X -> (forall x:set, x :e U -> exists V:set, V :e Tx /\ x :e V /\ V c= U) -> U :e Tx. let X Tx U. assume HTx: topology_on X Tx. assume HUSubX: U c= X."
18,continuity_equiv_forms,68769,"LATEX VERSION: Equivalent characterizations of continuity: open-preimage, closed-preimage, neighborhood criterion.","Theorem continuity_equiv_forms : forall X Tx Y Ty f:set, topology_on X Tx -> topology_on Y Ty -> (continuous_map X Tx Y Ty f <-> function_on f X Y /\ (forall V:set, V :e Ty -> preimage_of X f V :e Tx) /\ (forall C:set, closed_in Y Ty C -> c"
18,identity_continuous,68852,"FIXED: Identity function must use ordered pairs (tuple notation), not UPair.","Theorem identity_continuous : forall X Tx:set, topology_on X Tx -> let id := {(x,x)|x :e X} in continuous_map X Tx X Tx id. let X Tx. assume HTx: topology_on X Tx. prove let id := {(x,x)|x :e X} in continuous_map X Tx X Tx id. set id := {(x"
18,identity_continuous_R_lower_to_standard,68919,"LATEX VERSION: Since the standard topology is contained in the lower limit topology, the identity map is continuous from (R,R_ell) to (R,sta","Theorem identity_continuous_R_lower_to_standard : continuous_map R R_lower_limit_topology R R_standard_topology {(x,x)|x :e R}. prove continuous_map R R_lower_limit_topology R R_standard_topology {(x,x)|x :e R}. claim Hstd: topology_on R R_"
18,composition_continuous,69144,LATEX VERSION: (g∘f)^{-1}(W)=f^{-1}(g^{-1}(W)).," Theorem composition_continuous : forall X Tx Y Ty Z Tz f g:set, continuous_map X Tx Y Ty f -> continuous_map Y Ty Z Tz g -> continuous_map X Tx Z Tz (compose_fun X f g). let X Tx Y Ty Z Tz f g. assume Hf: continuous_map X Tx Y Ty f. assume"
18,continuous_construction_rules,69344,"LATEX VERSION: Theorem 18.2: Constant maps, inclusions, composites, domain restriction, range restriction/expansion, and local continuity fo","Theorem continuous_construction_rules : forall X Tx Y Ty Z Tz:set, topology_on X Tx -> topology_on Y Ty -> topology_on Z Tz -> (forall y0:set, y0 :e Y -> continuous_map X Tx Y Ty (const_fun X y0)) /\ (forall A:set, A c= X -> continuous_map "
18,continuous_map_local_cover,69819,"LATEX VERSION: If f is continuous on each member of an open cover of X, then f is continuous on X.","Theorem continuous_map_local_cover : forall X Tx Y Ty f:set, topology_on X Tx -> topology_on Y Ty -> (exists UFam:set, UFam c= Tx /\ Union UFam = X /\ (forall U:set, U :e UFam -> continuous_map U (subspace_topology X Tx U) Y Ty f)) -> conti"
18,continuous_on_subspace_rule,69876,"LATEX VERSION: If f is continuous on X and A⊂X, then f restricted to A is continuous with the subspace topology on A.","Theorem continuous_on_subspace_rule : forall X Tx Y Ty f A:set, topology_on X Tx -> topology_on Y Ty -> A c= X -> continuous_map X Tx Y Ty f -> continuous_map A (subspace_topology X Tx A) Y Ty f. let X Tx Y Ty f A. assume HTx: topology_on X"
18,product_space_component_sub,70001,"LATEX VERSION: If each component space is enlarged, then the product space is enlarged.","Theorem product_space_component_sub : forall I Xi Xi0:set, (forall i:set, i :e I -> space_family_set Xi0 i c= space_family_set Xi i) -> product_space I Xi0 c= product_space I Xi. let I Xi Xi0. assume Hsub: forall i:set, i :e I -> space_fami"
18,continuous_map_congr_on,70091,"LATEX VERSION: If f and g agree on X and f is continuous, then g is continuous.","Theorem continuous_map_congr_on : forall X Tx Y Ty f g:set, continuous_map X Tx Y Ty f -> function_on g X Y -> (forall x:set, x :e X -> apply_fun f x = apply_fun g x) -> continuous_map X Tx Y Ty g. let X Tx Y Ty f g. assume Hf: continuous_m"
18,homeomorphism_continuous,70631,LATEX VERSION: A homeomorphism is continuous.,"Theorem homeomorphism_continuous : forall X Tx Y Ty f:set, homeomorphism X Tx Y Ty f -> continuous_map X Tx Y Ty f. let X Tx Y Ty f. assume H: homeomorphism X Tx Y Ty f. exact (andEL (continuous_map X Tx Y Ty f) (exists g:set, continuous_ma"
18,homeomorphism_inverse_package,70644,LATEX VERSION: A homeomorphism has a continuous inverse.,"Theorem homeomorphism_inverse_package : forall X Tx Y Ty f:set, homeomorphism X Tx Y Ty f -> exists g:set, continuous_map Y Ty X Tx g /\ (forall x:set, x :e X -> apply_fun g (apply_fun f x) = x) /\ (forall y:set, y :e Y -> apply_fun f (appl"
18,homeomorphism_topology_left,70660,LATEX VERSION: A homeomorphism is defined between topological spaces.,"Theorem homeomorphism_topology_left : forall X Tx Y Ty f:set, homeomorphism X Tx Y Ty f -> topology_on X Tx. let X Tx Y Ty f. assume Hhom: homeomorphism X Tx Y Ty f. exact (continuous_map_topology_dom X Tx Y Ty f (homeomorphism_continuous X"
18,homeomorphism_topology_right,70669,LATEX VERSION: A homeomorphism is defined between topological spaces.,"Theorem homeomorphism_topology_right : forall X Tx Y Ty f:set, homeomorphism X Tx Y Ty f -> topology_on Y Ty. let X Tx Y Ty f. assume Hhom: homeomorphism X Tx Y Ty f. exact (continuous_map_topology_cod X Tx Y Ty f (homeomorphism_continuous "
18,continuous_on_subspace,75018,LATEX VERSION: Restricting a continuous map to a subspace remains continuous.,"Theorem continuous_on_subspace : forall X Tx Y Ty f A:set, topology_on X Tx -> A c= X -> continuous_map X Tx Y Ty f -> continuous_map A (subspace_topology X Tx A) Y Ty f. let X Tx Y Ty f A. assume HTx: topology_on X Tx. assume HA: A c= X. a"
18,homeomorphism_inverse_continuous,75116,LATEX VERSION: The inverse of a homeomorphism is continuous.,"Theorem homeomorphism_inverse_continuous : forall X Tx Y Ty f:set, homeomorphism X Tx Y Ty f -> exists g:set, continuous_map Y Ty X Tx g /\ (forall x:set, x :e X -> apply_fun g (apply_fun f x) = x) /\ (forall y:set, y :e Y -> apply_fun f (a"
18,homeomorphism_inverse_is_homeomorphism,75136,LATEX VERSION: If f is a homeomorphism then its inverse g is a homeomorphism.,"Theorem homeomorphism_inverse_is_homeomorphism : forall X Tx Y Ty f:set, homeomorphism X Tx Y Ty f -> exists g:set, homeomorphism Y Ty X Tx g. let X Tx Y Ty f. assume Hhom: homeomorphism X Tx Y Ty f. claim Hfcont: continuous_map X Tx Y Ty f"
18,homeomorphism_compose,75195,LATEX VERSION: Homeomorphisms are closed under composition.,"Theorem homeomorphism_compose : forall X Tx Y Ty Z Tz f g:set, homeomorphism X Tx Y Ty f -> homeomorphism Y Ty Z Tz g -> homeomorphism X Tx Z Tz (compose_fun X f g). let X Tx Y Ty Z Tz f g. assume Hhomf: homeomorphism X Tx Y Ty f. assume Hh"
18,subspace_union_of_opens,75586,"LATEX VERSION: From the local formulation of continuity preceding Theorem 18.3, inverse images can be checked locally on a cover, and unions","Theorem subspace_union_of_opens : forall X Tx A B U V:set, topology_on X Tx -> A :e Tx -> B :e Tx -> A :/\: B = Empty -> U :e subspace_topology X Tx A -> V :e subspace_topology X Tx B -> (U :\/: V) :e subspace_topology X Tx (A :\/: B). let "
18,pasting_lemma_total_functional,75672,"LATEX VERSION: From Theorem 18.3, if f and g are continuous on the pieces and agree on the overlap, the combined map h is continuous on the ","Theorem pasting_lemma_total_functional : forall X A B Y Tx Ty f g:set, topology_on X Tx -> A :e Tx -> B :e Tx -> A :/\: B = Empty -> graph_domain_subset f A -> graph_domain_subset g B -> functional_graph f -> functional_graph g -> continuou"
18,pasting_lemma_total_functional_imp,75770,"LATEX VERSION: Theorem 18.3 also holds if A and B are open sets in X, as a special case of the local formulation of continuity.","Theorem pasting_lemma_total_functional_imp : forall X A B Y Tx Ty f g:set, topology_on X Tx -> A :e Tx -> B :e Tx -> A :/\: B = Empty -> graph_domain_subset f A -> graph_domain_subset g B -> functional_graph f -> functional_graph g -> conti"
18,pasting_lemma,75800,"LATEX VERSION: Let X=A∪B, where A and B are closed in X. Let f:A→Y and g:B→Y be continuous. If f=g on A∩B, then the combined map h:X→Y defin","Theorem pasting_lemma : forall X A B Y Tx Ty f g:set, topology_on X Tx -> closed_in X Tx A -> closed_in X Tx B -> A :\/: B = X -> continuous_map A (subspace_topology X Tx A) Y Ty f -> continuous_map B (subspace_topology X Tx B) Y Ty g -> (f"
18,maps_into_products_axiom,76251,"LATEX VERSION: Theorem 18.4 says f:A→X x Y given by f(a)=(f1(a),f2(a)) is continuous iff f1 and f2 are continuous.","Theorem maps_into_products_axiom : forall A Ta X Tx Y Ty f g:set, continuous_map A Ta X Tx f -> continuous_map A Ta Y Ty g -> continuous_map A Ta (setprod X Y) (product_topology X Tx Y Ty) (pair_map A f g). let A Ta X Tx Y Ty f g. assume Hf"
18,maps_into_products,76370,"LATEX VERSION: Theorem 18.4, direction: if the coordinate maps f1 and f2 are continuous, then (f1,f2) is continuous.","Theorem maps_into_products : forall A Ta X Tx Y Ty f g:set, continuous_map A Ta X Tx f -> continuous_map A Ta Y Ty g -> continuous_map A Ta (setprod X Y) (product_topology X Tx Y Ty) (pair_map A f g). let A Ta X Tx Y Ty f g. assume Hf: cont"
19,product_component_def,34316,Helper: unfold product_component and product_component_topology,"Theorem product_component_def : forall Xi i:set, product_component Xi i = (apply_fun Xi i) 0. let Xi i. prove product_component Xi i = (apply_fun Xi i) 0. reflexivity. Qed. "
19,product_component_topology_def,34324,"LATEX VERSION: The component topology accessor returns the second coordinate of the pair (X_i,T_i).","Theorem product_component_topology_def : forall Xi i:set, product_component_topology Xi i = (apply_fun Xi i) 1. let Xi i. prove product_component_topology Xi i = (apply_fun Xi i) 1. reflexivity. Qed. "
19,space_family_set_eq_product_component,34370,LATEX VERSION: The space-family carrier accessor agrees with product_component.,"Theorem space_family_set_eq_product_component : forall Xi i:set, space_family_set Xi i = product_component Xi i. let Xi i. reflexivity. Qed. "
19,space_family_topology_eq_product_component_topology,34377,LATEX VERSION: The space-family topology accessor agrees with product_component_topology.,"Theorem space_family_topology_eq_product_component_topology : forall Xi i:set, space_family_topology Xi i = product_component_topology Xi i. let Xi i. reflexivity. Qed. "
19,product_space_graphI,34553,"LATEX VERSION: Given a family g with g(i)∈X_i, the graph i↦g(i) is a point of the cartesian product ∏X_i.","Theorem product_space_graphI : forall I Xi:set, forall g:set->set, (forall i:set, i :e I -> g i :e space_family_set Xi i) -> graph I g :e product_space I Xi. let I Xi g. assume HgXi: forall i:set, i :e I -> g i :e space_family_set Xi i. pro"
19,box_basis_coord_set_in_basis,34652,helper: a box basic set from coordinate opens lies in box_basis,"Theorem box_basis_coord_set_in_basis : forall I Xi:set, forall Ufun:set->set, (forall i:set, i :e I -> Ufun i :e space_family_topology Xi i) -> {f :e product_space I Xi | forall i:set, i :e I -> apply_fun f i :e Ufun i} :e box_basis I Xi. l"
19,projection_maps_continuous,76478,"LATEX VERSION: In the proof of Theorem 18.4, the projections pi1 and pi2 are continuous and pi1^{-1}(U)=U x Y, pi2^{-1}(V)=X x V.","Theorem projection_maps_continuous : forall X Tx Y Ty:set, topology_on X Tx -> topology_on Y Ty -> continuous_map (setprod X Y) (product_topology X Tx Y Ty) X Tx (projection_map1 X Y) /\ continuous_map (setprod X Y) (product_topology X Tx Y"
19,maps_into_products_converse,76558,"LATEX VERSION: If h : A -> X×Y is continuous, then each coordinate projection composed with h is continuous.","Theorem maps_into_products_converse : forall A Ta X Tx Y Ty h:set, topology_on X Tx -> topology_on Y Ty -> continuous_map A Ta (setprod X Y) (product_topology X Tx Y Ty) h -> continuous_map A Ta X Tx (compose_fun A h (projection_map1 X Y)) "
19,maps_into_products_coords_imp,76589,"LATEX VERSION: If h maps A into X×Y and the coordinate compositions are continuous, then h is continuous.","Theorem maps_into_products_coords_imp : forall A Ta X Tx Y Ty h:set, topology_on X Tx -> topology_on Y Ty -> function_on h A (setprod X Y) -> continuous_map A Ta X Tx (compose_fun A h (projection_map1 X Y)) -> continuous_map A Ta Y Ty (comp"
19,maps_into_products_iff_coords,76711,LATEX VERSION: A map h : A -> X×Y is continuous iff each projection composed with h is continuous.,"Theorem maps_into_products_iff_coords : forall A Ta X Tx Y Ty h:set, topology_on X Tx -> topology_on Y Ty -> function_on h A (setprod X Y) -> (continuous_map A Ta (setprod X Y) (product_topology X Tx Y Ty) h <-> (continuous_map A Ta X Tx (c"
19,projections_are_continuous,76739,LATEX VERSION: Projections from a product are continuous.,"Theorem projections_are_continuous : forall X Tx Y Ty:set, topology_on X Tx -> topology_on Y Ty -> continuous_map (setprod X Y) (product_topology X Tx Y Ty) X Tx (projection_map1 X Y) /\ continuous_map (setprod X Y) (product_topology X Tx Y"
19,product_topology_universal,76753,LATEX VERSION: The product topology is the coarsest topology on X×Y making the projections continuous.,"Theorem product_topology_universal : forall X Tx Y Ty:set, topology_on X Tx -> topology_on Y Ty -> exists Tprod:set, topology_on (setprod X Y) Tprod /\ continuous_map (setprod X Y) Tprod X Tx (projection_map1 X Y) /\ continuous_map (setprod"
19,product_topology_coarsest,76807,LATEX VERSION: Any topology on X×Y making the projections continuous contains the product topology.,"Theorem product_topology_coarsest : forall X Tx Y Ty Tprod:set, topology_on X Tx -> topology_on Y Ty -> topology_on (setprod X Y) Tprod -> continuous_map (setprod X Y) Tprod X Tx (projection_map1 X Y) -> continuous_map (setprod X Y) Tprod Y"
19,box_basis_is_basis_on,87285,LATEX VERSION: §19 box topology: basic open sets are products Π U_i where each U_i is open in X_i; these form a basis.,"Theorem box_basis_is_basis_on : forall I Xi:set, (forall i:set, i :e I -> topology_on (space_family_set Xi i) (space_family_topology Xi i)) -> basis_on (product_space I Xi) (box_basis I Xi). let I Xi. assume HcompTop: forall i:set, i :e I -"
19,box_topology_is_topology_on,87601,LATEX VERSION: §19: the topology generated by the box basis is called the box topology on the product.,"Theorem box_topology_is_topology_on : forall I Xi:set, (forall i:set, i :e I -> topology_on (space_family_set Xi i) (space_family_topology Xi i)) -> topology_on (product_space I Xi) (box_topology I Xi). let I Xi. assume HcompTop: forall i:s"
19,Romega_singleton_map_continuous_prod,89672,"LATEX VERSION: The coordinate-inclusion map r ↦ (r,0,0,...) is continuous in the product topology.",Theorem Romega_singleton_map_continuous_prod : continuous_map R R_standard_topology R_omega_space R_omega_product_topology Romega_singleton_map. prove continuous_map R R_standard_topology R_omega_space R_omega_product_topology Romega_single
19,Romega_extend_map_continuous_in_Romega_product,90210,LATEX VERSION: The extension map is continuous for the product topology on R^omega.,"Theorem Romega_extend_map_continuous_in_Romega_product : forall k:set, k :e omega -> continuous_map (setprod (Romega_tilde k) R) (product_topology (Romega_tilde k) (subspace_topology R_omega_space R_omega_product_topology (Romega_tilde k)) "
19,Romega_extend_map_continuous_to_Romega_tilde_succ,90784,LATEX VERSION: The extension map is continuous into R~(k+1) with the subspace topology.,"Theorem Romega_extend_map_continuous_to_Romega_tilde_succ : forall k:set, k :e omega -> continuous_map (setprod (Romega_tilde k) R) (product_topology (Romega_tilde k) (subspace_topology R_omega_space R_omega_product_topology (Romega_tilde k"
19,Romega_product_subbasis_on,90924,LATEX VERSION: Cylinder sets determined by one coordinate and an open set in R form a subbasis for the product topology on R^omega.,Theorem Romega_product_subbasis_on : subbasis_on R_omega_space (product_subbasis_full omega (const_space_family omega R R_standard_topology)). prove subbasis_on R_omega_space (product_subbasis_full omega (const_space_family omega R R_standa
19,Romega_coord_map_continuous_in_Romega_product,91028,LATEX VERSION: Each coordinate projection pi_i : R^omega -> R is continuous for the product topology.,"Theorem Romega_coord_map_continuous_in_Romega_product : forall i:set, i :e omega -> continuous_map R_omega_space R_omega_product_topology R R_standard_topology (Romega_coord_map i). let i. assume Hi: i :e omega. prove continuous_map R_omega"
19,Romega_coord_map_continuous_in_Romega_box,91149,"LATEX VERSION: Each coordinate projection pi_i is continuous for the box topology, since the box topology is finer than the product topology","Theorem Romega_coord_map_continuous_in_Romega_box : forall i:set, i :e omega -> continuous_map R_omega_space R_omega_box_topology R R_standard_topology (Romega_coord_map i). let i. assume Hi: i :e omega. prove continuous_map R_omega_space R"
19,Romega_restrict_map_continuous_in_Romega_product,91208,LATEX VERSION: The truncation map f ↦ f|_k is continuous for the product topology on R^omega.,"Theorem Romega_restrict_map_continuous_in_Romega_product : forall k:set, k :e omega -> continuous_map R_omega_space R_omega_product_topology R_omega_space R_omega_product_topology (Romega_restrict_map k). let k. assume HkO: k :e omega. set "
19,Romega_split_map_continuous,91492,LATEX VERSION: The identification R~(k+1) ≅ R~(k)×R is a homeomorphism; in particular the split map is continuous.,"Theorem Romega_split_map_continuous : forall k:set, k :e omega -> continuous_map (Romega_tilde (ordsucc k)) (subspace_topology R_omega_space R_omega_product_topology (Romega_tilde (ordsucc k))) (setprod (Romega_tilde k) R) (product_topology"
19,Romega_tilde_succ_homeomorphism,91777,LATEX VERSION: The extension map gives a homeomorphism R~(k) x R -> R~(k+1).,"Theorem Romega_tilde_succ_homeomorphism : forall k:set, k :e omega -> homeomorphism (setprod (Romega_tilde k) R) (product_topology (Romega_tilde k) (subspace_topology R_omega_space R_omega_product_topology (Romega_tilde k)) R R_standard_top"
19,Romega_product_cylinder_open,92254,"LATEX VERSION: Each cylinder pi_i^{-1}(U) is a subbasis element, hence open in the product topology.","Theorem Romega_product_cylinder_open : forall i U:set, i :e omega -> U :e space_family_topology (const_space_family omega R R_standard_topology) i -> product_cylinder omega (const_space_family omega R R_standard_topology) i U :e R_omega_pro"
19,Romega_tilde_subspace_box_subspace_product,92520,LATEX VERSION: Restricting the box topology to R^n yields the same opens as in the product topology.,"Theorem Romega_tilde_subspace_box_subspace_product : forall n:set, n :e omega -> subspace_topology R_omega_space R_omega_box_topology (Romega_tilde n) c= subspace_topology R_omega_space R_omega_product_topology (Romega_tilde n). let n. assu"
19,Romega_tilde_subspace_box_eq_product,92593,"LATEX VERSION: Since each inclusion holds, we obtain equality of the induced topologies on R^n.","Theorem Romega_tilde_subspace_box_eq_product : forall n:set, n :e omega -> subspace_topology R_omega_space R_omega_box_topology (Romega_tilde n) = subspace_topology R_omega_space R_omega_product_topology (Romega_tilde n). let n. assume HnO:"
19,Romega_infty_closed_in_Romega_box_topology,92605,LATEX VERSION: A sequence with infinitely many nonzero coordinates has a box neighborhood forcing infinitely many coordinates to stay nonzer,Theorem Romega_infty_closed_in_Romega_box_topology : closed_in R_omega_space R_omega_box_topology Romega_infty. prove closed_in R_omega_space R_omega_box_topology Romega_infty. set Xi := const_space_family omega R R_standard_topology. set X
19,Romega_infty_meets_product_basis,92881,LATEX VERSION: Any basic open neighborhood in the product topology contains a point of R^infty by truncating outside finitely many constrain,"Theorem Romega_infty_meets_product_basis : forall b x:set, b :e basis_of_subbasis R_omega_space (product_subbasis_full omega (const_space_family omega R R_standard_topology)) -> x :e b -> b :/\: Romega_infty <> Empty. let b x. assume Hb: b "
19,Romega_tilde0_singletons_dense_in_subspace,93263,LATEX VERSION: Any basic neighborhood of a point in R^0~ meets the set of singleton sequences.,Theorem Romega_tilde0_singletons_dense_in_subspace : closure_of (Romega_tilde 0) (subspace_topology R_omega_space R_omega_product_topology (Romega_tilde 0)) (image_of Romega_singleton_map R) = Romega_tilde 0. prove closure_of (Romega_tilde 
19,Romega_tilde0_connected,93342,"LATEX VERSION: The image of R under the singleton map is connected and dense in R^0~, so R^0~ is connected.",Theorem Romega_tilde0_connected : connected_space (Romega_tilde 0) (subspace_topology R_omega_space R_omega_product_topology (Romega_tilde 0)). prove connected_space (Romega_tilde 0) (subspace_topology R_omega_space R_omega_product_topology
20,open_in_metric_topology_has_eps_ball_sub,79217,"LATEX VERSION: If U is open in the metric topology and x∈U, then for some N, B(x,eps_N)⊂U.","Theorem open_in_metric_topology_has_eps_ball_sub : forall X d U x:set, metric_on X d -> open_in X (metric_topology X d) U -> x :e U -> exists N:set, N :e omega /\ open_ball X d x (eps_ N) c= U. let X d U x. assume Hm: metric_on X d. assume "
20,metric_topology_is_topology,79330,"LATEX VERSION: If d is a metric on X, the collection of all epsilon balls B_d(x,epsilon) (x∈X, epsilon>0) is a basis for a topology on X, ca","Theorem metric_topology_is_topology : forall X d:set, metric_on X d -> topology_on X (metric_topology X d). let X d. assume Hd: metric_on X d. prove topology_on X (metric_topology X d). exact (lemma_topology_from_basis X (famunion X (fun x "
20,open_ball_open_in_metric_topology,79463,"LATEX VERSION: In §20, the epsilon balls are the basis elements for the metric topology, hence each open ball is open.","Theorem open_ball_open_in_metric_topology : forall X d x r:set, metric_on X d -> x :e X -> Rlt 0 r -> open_in X (metric_topology X d) (open_ball X d x r). let X d x r. assume Hm: metric_on X d. assume Hx: x :e X. assume Hr: Rlt 0 r. set B :"
20,metric_topology_restrict_eq_subspace_topology,79635,LATEX VERSION: topology induced by restricted metric equals the subspace topology induced from the ambient metric topology,"Theorem metric_topology_restrict_eq_subspace_topology : forall X d A:set, metric_on X d -> A c= X -> metric_topology A (metric_restrict X d A) = subspace_topology X (metric_topology X d) A. let X d A. assume Hd: metric_on X d. assume HA: A "
20,uniform_topology_is_topology,122575,LATEX VERSION: The uniform metric on real sequences induces a topology.,Theorem uniform_topology_is_topology : topology_on real_sequences uniform_topology. prove topology_on real_sequences uniform_topology. claim Hdef: uniform_topology = metric_topology real_sequences uniform_metric_Romega. { reflexivity. } rew
20,uniform_topology_is_topology_on_Romega_space,122585,LATEX VERSION: The uniform metric on R omega induces the uniform topology on R omega.,Theorem uniform_topology_is_topology_on_Romega_space : topology_on R_omega_space uniform_topology. prove topology_on R_omega_space uniform_topology. rewrite <- (real_sequences_eq_Romega_space). exact uniform_topology_is_topology. Qed. 
20,Romega_product_topology_on_real_sequences_eq,122609,"LATEX VERSION: Identify R omega with real_sequences, so the induced product topology matches the whole-space product topology.",Theorem Romega_product_topology_on_real_sequences_eq : Romega_product_topology_on_real_sequences = R_omega_product_topology. prove Romega_product_topology_on_real_sequences = R_omega_product_topology. set Xi := const_space_family omega R R_
20,open_cover_family_sub,126971,"LATEX VERSION: If U is an open cover of X in Tx, then U ⊂ P(X).","Theorem open_cover_family_sub : forall X Tx U:set, topology_on X Tx -> open_cover X Tx U -> U c= Power X. let X Tx U. assume HTx: topology_on X Tx. assume Hcover: open_cover X Tx U. prove U c= Power X. let u. assume HuU: u :e U. prove u :e "
20,metric_topology_discrete_metric_eq_discrete_topology,240957,LATEX VERSION: The topology induced by the discrete metric is the discrete topology on X.,"Theorem metric_topology_discrete_metric_eq_discrete_topology : forall X:set, metric_topology X (discrete_metric X) = discrete_topology X. let X. apply set_ext. - let U. assume HU: U :e metric_topology X (discrete_metric X). prove U :e discr"
20,discrete_metric_complete,241040,"LATEX VERSION: Every Cauchy sequence in a discrete metric space is eventually constant, hence convergent, so the space is complete.","Theorem discrete_metric_complete : forall X:set, complete_metric_space X (discrete_metric X). let X. prove complete_metric_space X (discrete_metric X). prove metric_on X (discrete_metric X) /\ forall seq:set, sequence_on seq X -> cauchy_seq"
