sec,name,line,banner,stmt_preview
36,locally_finite_open_cover_neighborhood_finite_subunion,210384,"LATEX VERSION: If W is a locally finite open cover and x∈X, there is an open neighborhood N of x and a finite subfamily S⊆W with N⊆Union S.","Theorem locally_finite_open_cover_neighborhood_finite_subunion : forall X Tx W x:set, open_cover X Tx W -> locally_finite_family X Tx W -> x :e X -> exists N S:set, N :e Tx /\ x :e N /\ finite S /\ S c= W /\ N c= Union S. let X Tx W x. assu"
36,locally_finite_open_cover_closure_point_finite,210463,"LATEX VERSION: For a locally finite open cover W and x∈X, there is a finite subfamily S⊆W such that if x∈cl(w) then w∈S.","Theorem locally_finite_open_cover_closure_point_finite : forall X Tx W x:set, open_cover X Tx W -> locally_finite_family X Tx W -> x :e X -> exists S:set, finite S /\ S c= W /\ forall w:set, w :e W -> x :e closure_of X Tx w -> w :e S. let X"
36,locally_finite_subfamily,210526,LATEX VERSION: Any subfamily of a locally finite family is locally finite.,"Theorem locally_finite_subfamily : forall X Tx F G:set, locally_finite_family X Tx F -> G c= F -> locally_finite_family X Tx G. let X Tx F G. assume HLF: locally_finite_family X Tx F. assume HGF: G c= F. prove locally_finite_family X Tx G. "
36,locally_finite_family_Repl_subsets,210599,"LATEX VERSION: If W is locally finite and f(w) ⊆ w for all w∈W, then {f(w) | w∈W} is locally finite.","Theorem locally_finite_family_Repl_subsets : forall X Tx W:set, forall f:set->set, locally_finite_family X Tx W -> (forall w:set, w :e W -> f w c= w) -> locally_finite_family X Tx {f w|w :e W}. let X Tx W f. assume HWlf: locally_finite_fami"
36,locally_finite_family_point_finite_ex,210686,"LATEX VERSION: If F is locally finite, then each x lies in only finitely many members of F (existential finite witness form).","Theorem locally_finite_family_point_finite_ex : forall X Tx F:set, locally_finite_family X Tx F -> forall x:set, x :e X -> exists S:set, finite S /\ S c= F /\ forall A:set, A :e F -> x :e A -> A :e S. let X Tx F. assume HLF: locally_finite_"
36,finite_family_locally_finite,210743,LATEX VERSION: Any finite family of subsets is locally finite (choose neighborhood N=X and S=F).,"Theorem finite_family_locally_finite : forall X Tx F:set, topology_on X Tx -> finite F -> F c= Power X -> locally_finite_family X Tx F. let X Tx F. assume HTx: topology_on X Tx. assume HFfin: finite F. assume HFsubPow: F c= Power X. prove l"
36,finite_open_cover_locally_finite,210776,LATEX VERSION: Finite open covers are locally finite.,"Theorem finite_open_cover_locally_finite : forall X Tx U:set, topology_on X Tx -> open_cover X Tx U -> finite U -> locally_finite_family X Tx U. let X Tx U. assume HTx: topology_on X Tx. assume Hcov: open_cover X Tx U. assume HUfin: finite "
36,finite_open_cover_of_locally_finite,210793,"LATEX VERSION: In the packaged open_cover_of form, finiteness still implies local finiteness.","Theorem finite_open_cover_of_locally_finite : forall X Tx Fam:set, open_cover_of X Tx Fam -> finite Fam -> locally_finite_family X Tx Fam. let X Tx Fam. assume Hof: open_cover_of X Tx Fam. assume HFamFin: finite Fam. prove locally_finite_fa"
36,locally_finite_family_closures,210810,"LATEX VERSION: If a family is locally finite, then the family of its closures is locally finite as well.","Theorem locally_finite_family_closures : forall X Tx Fam:set, locally_finite_family X Tx Fam -> locally_finite_family X Tx {closure_of X Tx A|A :e Fam}. let X Tx Fam. assume HLF: locally_finite_family X Tx Fam. prove locally_finite_family X"
36,Union_locally_finite_closed_is_closed,210907,"LATEX VERSION: If Fam is locally finite and each A∈Fam is closed, then Union Fam is closed.","Theorem Union_locally_finite_closed_is_closed : forall X Tx Fam:set, locally_finite_family X Tx Fam -> (forall A:set, A :e Fam -> closed_in X Tx A) -> closed_in X Tx (Union Fam). let X Tx Fam. assume HLF: locally_finite_family X Tx Fam. ass"
36,locally_finite_open_cover_closures_closed_cover,211179,"LATEX VERSION: If W is a locally finite open cover, then {cl(w) | w∈W} is a locally finite closed cover of X.","Theorem locally_finite_open_cover_closures_closed_cover : forall X Tx W:set, open_cover X Tx W -> locally_finite_family X Tx W -> exists ClW:set, ClW = {closure_of X Tx w|w :e W} /\ ((forall C:set, C :e ClW -> closed_in X Tx C) /\ covers X "
36,normal_space_finite_open_cover_shrinking,211254,LATEX VERSION: Every finite open cover of a normal space admits an open refinement whose members have closures contained in members of the o,"Theorem normal_space_finite_open_cover_shrinking : forall X Tx W:set, normal_space X Tx -> open_cover X Tx W -> finite W -> exists V:set, open_cover X Tx V /\ finite V /\ (forall v:set, v :e V -> exists w:set, w :e W /\ v c= w) /\ forall v:"
36,normal_space_finite_open_cover_shrinking_closed,211631,"LATEX VERSION: If A is closed and covered by finitely many open sets, one can refine to finitely many open sets whose closures lie in member","Theorem normal_space_finite_open_cover_shrinking_closed : forall X Tx A F:set, normal_space X Tx -> closed_in X Tx A -> finite F -> (forall w:set, w :e F -> w :e Tx) -> A c= Union F -> exists V:set, finite V /\ (forall v:set, v :e V -> v :e"
36,locally_finite_open_cover_core_open_set,211841,"LATEX VERSION: For w in a locally finite open cover W of X, the set Bw = X \\ Union{cl(w0) | w0∈W\\{w}} is open, contained in w, and has cl(","Theorem locally_finite_open_cover_core_open_set : forall X Tx W w:set, topology_on X Tx -> open_cover X Tx W -> locally_finite_family X Tx W -> w :e W -> exists Bw:set, Bw :e Tx /\ Bw c= w /\ closure_of X Tx Bw c= w. let X Tx W w. assume HT"
36,locally_finite_open_cover_core_family,212038,"LATEX VERSION: From a locally finite open cover W of X, one can extract a locally finite family B of open sets, each b∈B lying in some w∈W w","Theorem locally_finite_open_cover_core_family : forall X Tx W:set, topology_on X Tx -> open_cover X Tx W -> locally_finite_family X Tx W -> exists B:set, (forall b:set, b :e B -> b :e Tx) /\ locally_finite_family X Tx B /\ (forall b:set, b "
36,finite_open_cover_has_partition_of_unity_family,216975,helper: construction of a partition of unity family subordinate to a finite open cover,"Theorem finite_open_cover_has_partition_of_unity_family : forall X Tx U:set, normal_space X Tx -> finite U -> open_cover X Tx U -> exists P:set, partition_of_unity_family X Tx U P. let X Tx U. assume Hnorm: normal_space X Tx. assume HUfin: "
36,finite_partition_of_unity_exists,217013,"LATEX VERSION: On a normal space, every finite open cover admits a partition of unity dominated by that cover.","Theorem finite_partition_of_unity_exists : forall X Tx U:set, normal_space X Tx -> finite U -> open_cover X Tx U -> partition_of_unity_dominated X Tx U. let X Tx U. assume Hnorm: normal_space X Tx. assume Hfin: finite U. assume Hcover: open"
36,locally_finite_family_empty,219938,LATEX VERSION: The empty family of subsets is locally finite.,"Theorem locally_finite_family_empty : forall X Tx:set, topology_on X Tx -> locally_finite_family X Tx Empty. let X Tx. assume HTx: topology_on X Tx. prove locally_finite_family X Tx Empty. prove topology_on X Tx /\ forall x:set, x :e X -> e"
36,locally_finite_family_closure_image,220015,"LATEX VERSION: If Fam is locally finite, then the family of closures {cl(A) | A in Fam} is locally finite.","Theorem locally_finite_family_closure_image : forall X Tx Fam:set, locally_finite_family X Tx Fam -> locally_finite_family X Tx {closure_of X Tx A|A :e Fam}. let X Tx Fam. assume HLF: locally_finite_family X Tx Fam. set ClFam := {closure_of"
36,finite_family_locally_finite_family,220138,LATEX VERSION: Every finite family of subsets is locally finite.,"Theorem finite_family_locally_finite_family : forall X Tx F:set, topology_on X Tx -> finite F -> locally_finite_family X Tx F. let X Tx F. assume HTx: topology_on X Tx. assume HFfin: finite F. prove locally_finite_family X Tx F. prove topol"
36,finite_open_cover_locally_finite_family,220171,"LATEX VERSION: Every finite family (in particular, every finite open cover) is locally finite.","Theorem finite_open_cover_locally_finite_family : forall X Tx U:set, topology_on X Tx -> open_cover X Tx U -> finite U -> locally_finite_family X Tx U. let X Tx U. assume HTx: topology_on X Tx. assume _: open_cover X Tx U. assume HUfin: fin"
36,normal_locally_finite_partition_of_unity_dominated,220186,"LATEX VERSION: In a normal space, every locally finite open cover W admits a partition of unity dominated by W.","Theorem normal_locally_finite_partition_of_unity_dominated : forall X Tx W:set, normal_space X Tx -> open_cover X Tx W -> locally_finite_family X Tx W -> partition_of_unity_dominated X Tx W. let X Tx W. assume Hnorm: normal_space X Tx. assu"
36,normal_locally_finite_refinement_partition_of_unity,220220,"LATEX VERSION: In a normal space, if W is a locally finite open refinement of U and U is an open cover, then U admits a partition of unity d","Theorem normal_locally_finite_refinement_partition_of_unity : forall X Tx U W:set, normal_space X Tx -> open_cover X Tx U -> open_cover X Tx W -> locally_finite_family X Tx W -> refine_of W U -> partition_of_unity_dominated X Tx U. let X Tx"
36,locally_finite_open_cover_neighborhood_finite_subcover,220242,"LATEX VERSION: If W is a locally finite open cover, then each x has an open neighborhood N meeting only finitely many members of W, hence N ","Theorem locally_finite_open_cover_neighborhood_finite_subcover : forall X Tx W x:set, open_cover X Tx W -> locally_finite_family X Tx W -> x :e X -> exists N:set, N :e Tx /\ x :e N /\ exists S:set, finite S /\ S c= W /\ N c= Union S /\ fora"
36,closure_Union_locally_finite_subset_Union_closures,220389,"LATEX VERSION: For a locally finite family Fam, closure(Union Fam) is contained in Union of closures of members.","Theorem closure_Union_locally_finite_subset_Union_closures : forall X Tx Fam:set, (forall A:set, A :e Fam -> A c= X) -> locally_finite_family X Tx Fam -> closure_of X Tx (Union Fam) c= Union {closure_of X Tx A|A :e Fam}. let X Tx Fam. assum"
36,closure_Union_locally_finite_sub_open,220577,"LATEX VERSION: For a locally finite family Fam with cl(A) ⊆ U for all A∈Fam and U open, we have cl(Union Fam) ⊆ U.","Theorem closure_Union_locally_finite_sub_open : forall X Tx Fam U:set, topology_on X Tx -> (forall A:set, A :e Fam -> A c= X) -> locally_finite_family X Tx Fam -> U :e Tx -> (forall A:set, A :e Fam -> closure_of X Tx A c= U) -> closure_of X"
37,net_converges_on_product_topology_full_implies_coord_converges,174515,"LATEX VERSION: If a net converges in the product topology, then for each i the composed net with the projection/evaluation map converges in ","Theorem net_converges_on_product_topology_full_implies_coord_converges : forall I Xi net J le x i:set, (forall j:set, j :e I -> topology_on (space_family_set Xi j) (space_family_topology Xi j)) -> i :e I -> net_converges_on (product_space I"
37,generated_topology_from_subbasis_finite_neighborhood,174563,"LATEX VERSION: In a topology generated by a subbasis, every open neighborhood contains a finite intersection of subbasis elements containing","Theorem generated_topology_from_subbasis_finite_neighborhood : forall X S U x:set, subbasis_on X S -> U :e generated_topology_from_subbasis X S -> x :e U -> exists F:set, F :e finite_subcollections S /\ x :e intersection_of_family X F /\ in"
37,net_converges_on_generated_topology_from_subbasis_of_subeventual,174619,"LATEX VERSION: In a topology generated by a subbasis S, it suffices for a net to be eventually in every subbasis neighborhood of x (and then","Theorem net_converges_on_generated_topology_from_subbasis_of_subeventual : forall X S net J le x:set, subbasis_on X S -> directed_set J le -> total_function_on net J X -> functional_graph net -> graph_domain_subset net J -> x :e X -> (foral"
37,product_subbasis_fullE,174790,LATEX VERSION: Every element of the product subbasis has the form pi_i^{-1}(U_i).,"Theorem product_subbasis_fullE : forall I Xi s:set, s :e product_subbasis_full I Xi -> exists i:set, i :e I /\ exists U:set, U :e space_family_topology Xi i /\ s = product_cylinder I Xi i U. let I Xi s. assume Hs: s :e product_subbasis_full"
37,net_converges_on_product_topology_full_of_all_coord_converge,174813,LATEX VERSION: A net in ∏X_i converges to x in the product topology iff each coordinate projection converges to x(i).,"Theorem net_converges_on_product_topology_full_of_all_coord_converge : forall I Xi net J le x:set, I <> Empty -> (forall i:set, i :e I -> topology_on (space_family_set Xi i) (space_family_topology Xi i)) -> directed_set J le -> total_functi"
37,net_converges_on_product_topology_full_iff_all_coord_converge,174914,LATEX VERSION: A net in ∏X_i converges to x in the product topology iff each coordinate projection converges to x(i).,"Theorem net_converges_on_product_topology_full_iff_all_coord_converge : forall I Xi net J le x:set, I <> Empty -> (forall i:set, i :e I -> topology_on (space_family_set Xi i) (space_family_topology Xi i)) -> directed_set J le -> total_funct"
37,continuous_combine_or_01,174954,"LATEX VERSION: If f and g are continuous, then a continuous max-like combination can be used to propagate 0 at a point and 1 on the union of","Theorem continuous_combine_or_01 : forall X Tx f g x0:set, topology_on X Tx -> continuous_map X Tx R R_standard_topology f -> continuous_map X Tx R R_standard_topology g -> x0 :e X -> apply_fun f x0 = 0 -> apply_fun g x0 = 0 -> exists h:set"
37,product_finite_subbasis_intersection_separator,175631,LATEX VERSION: A finite family of coordinate-separating continuous functions can be combined into one separating continuous function on the ,"Theorem product_finite_subbasis_intersection_separator : forall I Xi F x:set, I <> Empty -> completely_regular_spaces_family I Xi -> F :e finite_subcollections (product_subbasis_full I Xi) -> x :e intersection_of_family (product_space I Xi)"
37,net_pack_coord_projection_in_space,217038,helper for §37: coordinate projection of a packed net in a product,"Theorem net_pack_coord_projection_in_space : forall I Xi N i:set, net_pack_in_space (product_space I Xi) N -> i :e I -> exists Ni:set, net_pack_in_space (space_family_set Xi i) Ni /\ net_pack_index Ni = net_pack_index N /\ net_pack_le Ni = "
37,compact_space_closed_FIP_intersection_nonempty,217857,"LATEX VERSION: In a compact space, any family of closed sets with the finite intersection property has nonempty intersection.","Theorem compact_space_closed_FIP_intersection_nonempty : forall X Tx D:set, compact_space X Tx -> (forall C:set, C :e D -> closed_in X Tx C) -> finite_intersection_property X D -> intersection_of_family X D <> Empty. let X Tx D. assume Hcom"
37,compact_space_of_closed_FIP_intersection_nonempty,218025,LATEX VERSION: A space is compact iff every family of closed sets with the finite intersection property has nonempty intersection. (This is ,"Theorem compact_space_of_closed_FIP_intersection_nonempty : forall X Tx:set, topology_on X Tx -> (forall D:set, (forall C:set, C :e D -> closed_in X Tx C) -> finite_intersection_property X D -> intersection_of_family X D <> Empty) -> compac"
37,net_pack_coord_projection_has_convergent_subnet_in_compact_factor,218186,"LATEX VERSION: If X_i is compact and N is a packed net in ∏_{i∈I} X_i, then the projected packed net N_i has a convergent packed subnet in X","Theorem net_pack_coord_projection_has_convergent_subnet_in_compact_factor : forall I Xi N i:set, net_pack_in_space (product_space I Xi) N -> i :e I -> compact_space (product_component Xi i) (product_component_topology Xi i) -> exists Ni Si "
37,Tychonoff_theorem,218296,FIXED: Hypothesis quantifies i only over i:e I (not all sets).,"Theorem Tychonoff_theorem : forall I Xi:set, (forall i:set, i :e I -> compact_space (product_component Xi i) (product_component_topology Xi i)) -> compact_space (product_space I Xi) (product_topology_full I Xi). let I Xi. assume Hcomp: fora"
37,R_standard_open_has_compact_closure_neighborhood,218737,"LATEX VERSION: If U is open in the standard topology on R and x in U, then there exists open W with x in W, cl(W) c= U, and cl(W) is compact","Theorem R_standard_open_has_compact_closure_neighborhood : forall U x:set, U :e R_standard_topology -> x :e U -> exists W:set, W :e R_standard_topology /\ x :e W /\ closure_of R R_standard_topology W c= U /\ compact_space (closure_of R R_st"
37,R_standard_topology_locally_compact,218941,LATEX VERSION: R with the standard topology is locally compact.,"Theorem R_standard_topology_locally_compact : locally_compact R R_standard_topology. prove locally_compact R R_standard_topology. prove topology_on R R_standard_topology /\ forall x:set, x :e R -> exists C:set, C c= R /\ compact_space C (su"
37,locally_compact_regular_open_has_compact_closure_neighborhood,218987,"LATEX VERSION: In a locally compact regular space, each point in an open set has an open neighborhood with compact closure contained in that","Theorem locally_compact_regular_open_has_compact_closure_neighborhood : forall X Tx U x:set, locally_compact X Tx -> regular_space X Tx -> U :e Tx -> x :e U -> exists W:set, W :e Tx /\ x :e W /\ closure_of X Tx W c= U /\ compact_space (clos"
38,Stone_Cech_universal_property,219742,"LATEX VERSION: For a Tychonoff space (X,Tx), the Stone Cech compactification exists and is compact Hausdorff.","Theorem Stone_Cech_universal_property : forall X Tx:set, Tychonoff_space X Tx -> exists Ty:set, compact_space (Stone_Cech_compactification X Tx) Ty /\ Hausdorff_space (Stone_Cech_compactification X Tx) Ty. let X Tx. assume HT: Tychonoff_spa"
38,partition_of_unity_dominated_refine,219911,"LATEX VERSION: If V admits a partition of unity on X and V refines U, then U admits a partition of unity on X.","Theorem partition_of_unity_dominated_refine : forall X Tx U V:set, open_cover X Tx U -> partition_of_unity_dominated X Tx V -> refine_of V U -> partition_of_unity_dominated X Tx U. let X Tx U V. assume HUcov: open_cover X Tx U. assume HPV: "
39,well_ordered_set_is_ordinal,77974,"LATEX VERSION: We use the well ordering theorem to obtain a well-ordered set, and then extract its ordinal carrier.","Theorem well_ordered_set_is_ordinal : forall X:set, well_ordered_set X -> ordinal X. let X. assume Hwo: well_ordered_set X. set T0 := ordinal X /\ X <> R. set T1 := T0 /\ X <> rational_numbers. set T2 := T1 /\ X <> setprod 2 omega. set T3 :"
39,lemma39_1b_closures_locally_finite,220623,"LATEX VERSION: If A is locally finite, then the collection of closures {cl(A)} is locally finite.","Theorem lemma39_1b_closures_locally_finite : forall X Tx Fam:set, (forall A:set, A :e Fam -> A c= X) -> locally_finite_family X Tx Fam -> locally_finite_family X Tx {closure_of X Tx A|A :e Fam}. let X Tx Fam. assume _ : forall A:set, A :e F"
39,lemma39_1c_closure_Union_eq_Union_closures,220635,"LATEX VERSION: If A is locally finite and Y=⋃A, then cl(Y)=⋃{cl(A) | A∈A}.","Theorem lemma39_1c_closure_Union_eq_Union_closures : forall X Tx Fam:set, topology_on X Tx -> (forall A:set, A :e Fam -> A c= X) -> locally_finite_family X Tx Fam -> closure_of X Tx (Union Fam) = Union {closure_of X Tx A|A :e Fam}. let X Tx"
39,locally_finite_family_closure_point_finite_ex,220651,"LATEX VERSION: If a family is locally finite, then only finitely many closures contain a given point.","Theorem locally_finite_family_closure_point_finite_ex : forall X Tx Fam:set, topology_on X Tx -> (forall A:set, A :e Fam -> A c= X) -> locally_finite_family X Tx Fam -> forall x:set, x :e X -> exists S:set, finite S /\ S c= {closure_of X Tx"
39,sigma_locally_finite_basis_data,220706,LATEX VERSION: A sigma locally finite basis provides a countable family of locally finite families whose union generates the topology.,"Theorem sigma_locally_finite_basis_data : forall X Tx:set, sigma_locally_finite_basis X Tx -> exists Fams:set, countable_set Fams /\ Fams c= Power (Power X) /\ (forall F:set, F :e Fams -> locally_finite_family X Tx F) /\ basis_generates X ("
39,basis_generates_imp_basis_refines,220732,"LATEX VERSION: If a basis B generates Tx, then every open set U in Tx is the union of basis elements contained in U.","Theorem basis_generates_imp_basis_refines : forall X Tx B:set, basis_generates X B Tx -> basis_refines X B Tx. let X Tx B. assume Hgen: basis_generates X B Tx. prove basis_refines X B Tx. prove topology_on X Tx /\ (forall U :e Tx, forall x "
39,second_countable_implies_sigma_locally_finite_basis,220769,helper: second countable implies sigma locally finite basis (singleton decomposition),"Theorem second_countable_implies_sigma_locally_finite_basis : forall X Tx:set, second_countable_space X Tx -> sigma_locally_finite_basis X Tx. let X Tx. assume Hscc: second_countable_space X Tx. prove sigma_locally_finite_basis X Tx. claim "
40,complete_metric_space_uniform_metric_power_real,184806,"LATEX VERSION: The uniform metric space (R^J,rho) is complete.","Theorem complete_metric_space_uniform_metric_power_real : forall J:set, complete_metric_space (power_real J) (uniform_metric_power_real J). let J. prove metric_on (power_real J) (uniform_metric_power_real J) /\ forall seq:set, sequence_on s"
40,uniform_limit_of_continuous_to_R_standard_topology,185039,"LATEX VERSION: If f_n:X->R are continuous (usual topology) and converge uniformly in the bounded metric, then the limit is continuous.","Theorem uniform_limit_of_continuous_to_R_standard_topology : forall X Tx fn f:set, topology_on X Tx -> function_on fn omega (function_space X R) -> function_on f X R -> (forall n:set, n :e omega -> continuous_map X Tx R R_standard_topology "
40,uniform_cauchy_continuous_to_R_has_continuous_limit,185072,"LATEX VERSION: In a complete metric codomain, a uniformly Cauchy sequence of continuous functions has a continuous uniform limit.","Theorem uniform_cauchy_continuous_to_R_has_continuous_limit : forall X Tx fn:set, topology_on X Tx -> function_on fn omega (function_space X R) -> (forall n:set, n :e omega -> continuous_map X Tx R R_standard_topology (apply_fun fn n)) -> u"
40,Union_subfamily_locally_finite_closed_is_closed_early,220888,"LATEX VERSION: If Fam is locally finite and each A in Fam is closed, then the union of any subfamily is closed.","Theorem Union_subfamily_locally_finite_closed_is_closed_early : forall X Tx Fam S:set, locally_finite_family X Tx Fam -> (forall A:set, A :e Fam -> closed_in X Tx A) -> S c= Fam -> closed_in X Tx (Union S). let X Tx Fam S. assume HLFam: loc"
40,lemma40_1_step1_open_as_countable_union,220965,"LATEX VERSION: If W is open, then there is a countable collection {U_n} of open sets such that W = ⋃ U_n = ⋃ cl(U_n).","Theorem lemma40_1_step1_open_as_countable_union : forall X Tx W:set, regular_space X Tx -> sigma_locally_finite_basis X Tx -> W :e Tx -> exists Ufam:set, countable_set Ufam /\ Ufam c= Tx /\ Union Ufam = W /\ forall U:set, U :e Ufam -> closu"
40,lemma40_1_regular_sigma_basis_implies_normal_and_closed_Gdelta,221622,"LATEX VERSION: Let X be a regular space with a basis B that is countably locally finite. Then X is normal, and every closed set in X is a G_","Theorem lemma40_1_regular_sigma_basis_implies_normal_and_closed_Gdelta : forall X Tx:set, regular_space X Tx -> sigma_locally_finite_basis X Tx -> normal_space X Tx /\ (forall C:set, closed_in X Tx C -> Gdelta_simple X Tx C). let X Tx. assu"
40,open_set_has_positive_support_function,224032,"LATEX VERSION: In a normal space where every closed set is G_delta, for each open U there is continuous f:X->[0,1] with f=0 on X-U and f>0 o","Theorem open_set_has_positive_support_function : forall X Tx U:set, normal_space X Tx -> (forall C:set, closed_in X Tx C -> Gdelta_simple X Tx C) -> U :e Tx -> exists f:set, f :e function_space X R /\ continuous_map X Tx R R_standard_topolo"
40,open_set_has_positive_support_function_unit_interval,224199,"LATEX VERSION: In a normal space where every closed set is G_delta, for each open U there is continuous f:X->[0,1] with f=0 on X-U and f>0 o","Theorem open_set_has_positive_support_function_unit_interval : forall X Tx U:set, normal_space X Tx -> (forall C:set, closed_in X Tx C -> Gdelta_simple X Tx C) -> U :e Tx -> exists f0:set, continuous_map X Tx unit_interval unit_interval_top"
40,locally_finite_basis_imp_sigma_locally_finite_basis,227343,LATEX VERSION: A locally finite basis is sigma locally finite (take the singleton family).,"Theorem locally_finite_basis_imp_sigma_locally_finite_basis : forall X Tx:set, locally_finite_basis X Tx -> sigma_locally_finite_basis X Tx. let X Tx. assume Hlfb: locally_finite_basis X Tx. prove sigma_locally_finite_basis X Tx. claim HTx:"
40,Nagata_Smirnov_metrization_theorem,232704,MOVED: Placed after the forward direction theorem `Nagata_Smirnov_metrization` to avoid forward references in Megalodon.,"Theorem Nagata_Smirnov_metrization_theorem : forall X Tx:set, metrizable X Tx <-> (regular_space X Tx /\ sigma_locally_finite_basis X Tx). let X Tx. apply iffI. - assume Hmet: metrizable X Tx. prove regular_space X Tx /\ sigma_locally_finit"
41,reciprocal_of_positive_continuous_map,205076,"LATEX VERSION: If f is continuous and f(x)>0, then x -> 1/f(x) is continuous.","Theorem reciprocal_of_positive_continuous_map : forall X Tx f:set, topology_on X Tx -> continuous_map X Tx R R_standard_topology f -> (forall x:set, x :e X -> Rlt 0 (apply_fun f x)) -> continuous_map X Tx R R_standard_topology (compose_fun "
41,local_support_finite_outside_F0_zero_on_open,206360,"LATEX VERSION: If a neighborhood N meets the support of a function only when that function lies in a fixed finite family F0, then any functi","Theorem local_support_finite_outside_F0_zero_on_open : forall X Tx P N F0 f:set, topology_on X Tx -> N :e Tx -> F0 c= P -> (forall g:set, g :e P -> support_of X Tx g :/\: N <> Empty -> g :e F0) -> f :e P -> ~(f :e F0) -> forall x:set, x :e "
